,img_link,tags,likes,comments
3988,https://cdn.pixabay.com/photo/2021/10/23/09/25/ink-6734479__340.jpg,"Ink, Watercolor, Colors, Smoke",12,2
3989,https://cdn.pixabay.com/photo/2017/03/10/12/42/ukraine-2132669__340.jpg,"Ukraine, Peace, Hand, Nation, Background",65,17
3990,https://cdn.pixabay.com/photo/2022/03/12/23/13/crocus-7065008__340.jpg,"Crocus, Flower, Purple Flower, Petals",6,1
3991,https://cdn.pixabay.com/photo/2022/03/18/22/59/animal-7077601__340.jpg,"Animal, Rhinoceros, Zoo, Rhino, Wildlife",0,0
3992,https://cdn.pixabay.com/photo/2021/09/09/19/34/cows-6611452__340.jpg,"Cows, Pasture, Nature, Hill, Meadow",26,38
3993,https://cdn.pixabay.com/photo/2014/08/12/00/01/santorini-416135__340.jpg,"Santorini, Greece, Buildings, Houses",483,83
3994,https://cdn.pixabay.com/photo/2021/11/20/07/57/mountains-6811121__340.jpg,"Mountains, Clouds, Alpine Pastures, Fall",41,36
3995,https://cdn.pixabay.com/photo/2018/10/18/18/43/portrait-3757153__340.jpg,"Portrait, Face, Listen, To Speak, See",244,35
3996,https://cdn.pixabay.com/photo/2021/11/18/16/12/bird-6806741__340.jpg,"Bird, Parrot, Ornithology, Species",55,58
3997,https://cdn.pixabay.com/photo/2017/08/07/18/28/businessman-2606509__340.jpg,"Businessman, Consulting, Business",281,66
3998,https://cdn.pixabay.com/photo/2021/07/11/06/56/planets-6403048__340.jpg,"Planets, Space, First Order Tie Fighter",12,2
3999,https://cdn.pixabay.com/photo/2022/02/20/17/53/mountains-7025022__340.jpg,"Mountains, Valley, Rocks, Cliffs, Canyon",2,0
4000,https://cdn.pixabay.com/photo/2020/06/07/14/11/field-5270586__480.jpg,"Field, Sunset, Light, Poppy, Summer",92,28
4001,https://cdn.pixabay.com/photo/2021/04/12/11/45/football-6172339__340.jpg,"Football, Players, Team, Sports, Grass",8,1
4002,https://cdn.pixabay.com/photo/2016/10/14/18/21/tee-1740871__340.jpg,"Tee, Teacup, Tea Bag, Cup, Drink",382,51
4003,https://cdn.pixabay.com/photo/2021/09/15/00/35/room-6625345__340.jpg,"Room, Window, View, Interior, Table",37,65
4004,https://cdn.pixabay.com/photo/2018/01/22/21/34/sever-3100049__340.jpg,"Sever, Digitization, Mainframe, Computer",131,20
4005,https://cdn.pixabay.com/photo/2020/09/30/14/55/notebook-5616034__340.jpg,"Notebook, Pencils, Quote, Reminder",40,24
4006,https://cdn.pixabay.com/photo/2021/08/14/20/56/flower-6546256__340.jpg,"Flower, Agapanthus, Ornamental Lily",75,58
4007,https://cdn.pixabay.com/photo/2022/01/08/18/35/flower-6924582__340.jpg,winterkirsche,12,10
4008,https://cdn.pixabay.com/photo/2022/02/06/08/08/religion-6996491__340.jpg,"Religion, Figure, Holier, Bishop, Church",23,19
4009,https://cdn.pixabay.com/photo/2019/12/05/12/32/penguin-4675025__340.jpg,"Penguin, Figure, Deco, Decoration, Few",166,61
4010,https://cdn.pixabay.com/photo/2016/08/12/08/01/door-1587863__340.jpg,"Door, Lock, Blue Door, Rusted",407,57
4011,https://cdn.pixabay.com/photo/2022/03/08/17/00/cat-7056171__340.jpg,"Cat, Pet, Feline, Animal, Fur, Kitty",8,5
4012,https://cdn.pixabay.com/photo/2021/11/10/13/25/cat-6783915__340.jpg,"Cat, Pet, Feline, Animal, Fur, Kitty",27,27
4013,https://cdn.pixabay.com/photo/2022/01/30/15/46/casual-shoes-6981452__340.jpg,"Casual Shoes, Running Shoes, Trainers",21,2
4014,https://cdn.pixabay.com/photo/2016/11/18/22/21/restaurant-1837150__340.jpg,"Restaurant, Furniture, Interiors",134,32
4015,https://cdn.pixabay.com/photo/2019/09/06/15/59/autumn-4456618__340.jpg,"Autumn, Garden, Nature, Wood, Avenue",93,24
4016,https://cdn.pixabay.com/photo/2019/08/03/12/22/hot-air-balloons-4381674__480.jpg,"Hot Air Balloons, Colorful, Balloon",137,31
4017,https://cdn.pixabay.com/photo/2021/09/03/16/18/forestry-6596153__340.jpg,"Forestry, Timber, Logging, Clear-Cutting",7,3
4018,https://cdn.pixabay.com/photo/2021/03/26/07/52/tulip-6125148__340.jpg,"Tulip, Flower, Background, Copy Space",14,4
4019,https://cdn.pixabay.com/photo/2021/03/18/22/20/bumblebee-6105984__340.jpg,"Bumblebee, Bee, Flower, Insect, Animal",64,20
4020,https://cdn.pixabay.com/photo/2022/02/21/21/18/animal-7027637__340.jpg,"Animal, Rodent, Baby Mouse, Mouse, Hand",8,2
4021,https://cdn.pixabay.com/photo/2022/01/26/06/56/planet-6968177__340.jpg,"Planet, Space, Stars, Galaxy, Milky Way",6,0
4022,https://cdn.pixabay.com/photo/2022/02/15/17/59/forest-7015394__340.jpg,"Forest, Mountains, Winter",8,4
4023,https://cdn.pixabay.com/photo/2020/08/04/19/44/erotica-5463712__340.jpg,"Erotica, Nude, Naked, Figure, Body",109,18
4024,https://cdn.pixabay.com/photo/2021/12/30/07/26/bird-6903428__340.jpg,"Bird, Seagull, Ornithology, Species",30,29
4025,https://cdn.pixabay.com/photo/2018/10/06/16/26/fantasy-3728189__340.jpg,"Fantasy, Vault, Moon, Monastery, Abbey",201,43
4026,https://cdn.pixabay.com/photo/2022/02/22/21/43/helleborus-niger-7029641__340.jpg,"Helleborus Niger, Christmas Rose",12,11
4027,https://cdn.pixabay.com/photo/2021/12/28/16/19/candle-6899693__340.jpg,"Candle, Candlelight, Flame, Light, Mood",40,35
4028,https://cdn.pixabay.com/photo/2018/07/08/01/44/mountains-3523153__340.jpg,"Mountains, Nature, Travel, Alpine",244,30
4029,https://cdn.pixabay.com/photo/2021/12/28/17/32/funny-6899941__340.jpg,"Funny, Monkey, Tuk, Tuk-Tuk, Collage Art",17,13
4030,https://cdn.pixabay.com/photo/2021/12/09/01/57/little-girl-6857081__480.jpg,"Little Girl, Ancient Costume",4,0
4031,https://cdn.pixabay.com/photo/2022/03/05/20/03/paragliding-7050201__340.jpg,"Paragliding, Adventure, Recreation",12,7
4032,https://cdn.pixabay.com/photo/2021/12/08/18/19/banknotes-6856420__340.jpg,"Banknotes, Currency, Inflation, Euro",25,23
4033,https://cdn.pixabay.com/photo/2022/03/31/17/44/church-7103459__340.jpg,"Church, Worship, Catholic, Christian",0,0
4034,https://cdn.pixabay.com/photo/2017/11/08/04/26/rock-2929208__340.jpg,"Stone, Tile, Marble, Structure, Marble",128,30
4035,https://cdn.pixabay.com/photo/2021/12/14/10/05/forest-6870238__340.jpg,"Forest, Mushroom, Moss, Nature, Fungus",25,20
4036,https://cdn.pixabay.com/photo/2022/02/15/22/13/art-7015703__340.jpg,"Art, Nature, Landscape, Sky, Mountains",6,1
4037,https://cdn.pixabay.com/photo/2021/09/13/10/37/background-6620952__340.jpg,"Background, Pattern, Fruit, Texture",27,20
4038,https://cdn.pixabay.com/photo/2018/08/09/03/58/home-3593729__340.jpg,"Home, Decor, Real Estate, Bathroom",127,14
4039,https://cdn.pixabay.com/photo/2021/12/05/16/07/corona-6848112__340.jpg,"Corona, Quick Test, Pandemic, Covid19",3,0
4040,https://cdn.pixabay.com/photo/2021/02/02/15/08/abstract-5974318__340.jpg,"Abstract, Painting, Artist, Creative",28,7
4041,https://cdn.pixabay.com/photo/2021/10/09/02/23/cocktail-6692791__340.jpg,"Cocktail, Mojito, Alcohol, Drink",8,0
4042,https://cdn.pixabay.com/photo/2016/12/20/22/32/holiday-shopping-1921658__340.jpg,"Holiday Shopping, Smartphone, Telephone",235,44
4043,https://cdn.pixabay.com/photo/2021/09/17/23/58/kitten-6633938__340.jpg,"Kitten, Cat, Pet, Feline, Animal, Fur",43,40
4044,https://cdn.pixabay.com/photo/2022/02/23/21/52/crocus-7031496__340.jpg,"Crocus, Flower, Purple Flowers, Petals",8,7
4045,https://cdn.pixabay.com/photo/2022/04/02/03/08/city-7106235__340.jpg,"City, Field, Sunset, Landscape, Urban",1,0
4046,https://cdn.pixabay.com/photo/2020/10/05/10/04/surfing-5628803__480.jpg,"Surfing, Waves, Sport, Surfer, Man",63,19
4047,https://cdn.pixabay.com/photo/2016/12/05/16/46/pine-1884335__340.jpg,"Pine, Plant, Tree, Branch, Conifer",369,25
4048,https://cdn.pixabay.com/photo/2022/04/03/18/45/wrought-iron-7109650__340.jpg,"Photo taken with analogous lens Vivitar 35 - 105 mm, f3.5 MC Zoom",3,1
4049,https://cdn.pixabay.com/photo/2020/08/30/21/44/vampire-5530776__340.jpg,"Vampire, Mask, Man, Mysterious, Horror",57,9
4050,https://cdn.pixabay.com/photo/2022/03/28/11/44/costa-rica-7097263__340.jpg,"Costa Rica, Parque Nacional Barra Honda",0,0
4051,https://cdn.pixabay.com/photo/2016/08/11/23/25/glass-1587258__340.jpg,"Glass, Milk, Pour, Pouring, Pouring Milk",214,47
4052,https://cdn.pixabay.com/photo/2022/02/07/23/07/tricolored-heron-7000486__340.jpg,"Tricolored Heron, Bird, Animal, Heron",6,4
4053,https://cdn.pixabay.com/photo/2021/11/18/09/55/trees-6806003__340.jpg,"Trees, Forest, Early Fog, Sunbeams",57,52
4054,https://cdn.pixabay.com/photo/2022/03/15/16/42/grape-hyacinth-7070696__340.jpg,"Grape Hyacinth, Flowers, Plants",3,1
4055,https://cdn.pixabay.com/photo/2018/06/10/15/54/house-3466731__340.jpg,"House, Trash, Ruin, Concrete",79,10
4056,https://cdn.pixabay.com/photo/2016/09/13/09/25/kite-1666816__340.jpg,"Kite, Mother, Family, Sky, Happy, Flying",273,33
4057,https://cdn.pixabay.com/photo/2021/09/29/07/22/mountains-6666698__340.jpg,"Mountains, Sea, Fjord, Outlook, Lofoten",16,11
4058,https://cdn.pixabay.com/photo/2020/04/21/23/25/sky-apartment-5074975__480.jpg,"Sky Apartment, View, Clouds, Sky, Moon",70,27
4059,https://cdn.pixabay.com/photo/2020/05/12/15/35/mask-5163617__340.jpg,"Mask, Mouth Guard, Girl, Finger, Corona",119,26
4060,https://cdn.pixabay.com/photo/2021/06/10/19/28/white-flowers-6326852__340.jpg,"White Flowers, Chamomile, Meadows",67,58
4061,https://cdn.pixabay.com/photo/2020/01/27/09/17/landscape-4796735__340.jpg,"Landscape, Wolves, Forest, Night, Moon",150,57
4062,https://cdn.pixabay.com/photo/2022/03/16/01/51/animal-7071420__340.jpg,"Animal, Cheetah, Mammal, Species, Fauna",5,1
4063,https://cdn.pixabay.com/photo/2019/06/05/14/27/forest-4253766__340.jpg,"Forest, Fantasy, Deer, Mysterious, Night",214,80
4064,https://cdn.pixabay.com/photo/2021/05/07/11/40/dolphin-6235882__340.jpg,"Dolphin, Animal, Swim, Water, Mammal",25,12
4065,https://cdn.pixabay.com/photo/2016/11/18/19/55/guitar-1836655__340.jpg,"Guitar, Music, Acoustic Guitar",235,49
4066,https://cdn.pixabay.com/photo/2022/02/21/03/06/hawk-7025640__340.jpg,"Hawk, Raptor, Wildlife, Predator, Bird",12,7
4067,https://cdn.pixabay.com/photo/2021/08/23/14/42/sunrise-6567956__340.jpg,"Sunrise, River, Nature, Meadow, Water",13,3
4068,https://cdn.pixabay.com/photo/2020/09/29/21/11/roses-5613974__340.jpg,"Roses, Bush, Red Roses, Red Flowers",53,26
4069,https://cdn.pixabay.com/photo/2022/02/12/17/18/beer-7009462__340.jpg,"Beer, Beer Bottle, Drink, Alcohol",22,22
4070,https://cdn.pixabay.com/photo/2022/02/13/05/38/moon-7010387__340.jpg,"Moon, Stars, Planet, Earth, Sky",6,0
4071,https://cdn.pixabay.com/photo/2021/11/27/06/25/deers-6827359__340.jpg,"Deers, Antlers, Animals, Forest, Mammals",21,7
4072,https://cdn.pixabay.com/photo/2021/05/28/04/51/red-6289828__340.jpg,"Red, Rose, Flower, Flora, Plant, Petals",101,86
4073,https://cdn.pixabay.com/photo/2022/04/05/08/10/fork-crane-7113089__480.jpg,"Fork Crane, Machine",1,0
4074,https://cdn.pixabay.com/photo/2016/07/10/09/40/dew-1507498__340.jpg,"Dew, Grass, Morning, Morning Dew",319,44
4075,https://cdn.pixabay.com/photo/2018/08/15/10/13/network-3607641__340.jpg,"Network, Earth, Blockchain, Globe",88,15
4076,https://cdn.pixabay.com/photo/2020/06/30/10/05/photographer-5355840__340.jpg,"Photographer, Coronavirus, Mask, Retro",83,21
4077,https://cdn.pixabay.com/photo/2021/06/11/16/02/clouds-6328911__340.jpg,"Clouds, Sky, Sunrays, Sunlight, Sunbeams",97,87
4078,https://cdn.pixabay.com/photo/2021/08/15/17/46/dog-6548478__340.jpg,"Dog, Hybrid, Domestic Animal, Brown",47,58
4079,https://cdn.pixabay.com/photo/2020/03/29/19/20/dusseldorf-4981936__340.jpg,"Dusseldorf, Playhouse, Theatre",63,17
4080,https://cdn.pixabay.com/photo/2021/10/09/18/49/blueberries-6694955__340.jpg,None,59,51
4081,https://cdn.pixabay.com/photo/2022/02/10/20/48/animals-7006110__340.jpg,"Animals, Deer, Mammal, Species, Fauna",14,2
4082,https://cdn.pixabay.com/photo/2021/09/09/16/00/dahlia-6611058__340.jpg,"Dahlia, Pink Flower, Pink Dahlia, Garden",56,44
4083,https://cdn.pixabay.com/photo/2017/09/06/18/22/clover-2722470__340.jpg,"Clover, Leaves, Dew, Four Leaf Clover",375,132
4084,https://cdn.pixabay.com/photo/2020/11/01/02/29/bread-5702703__340.jpg,"Bread, Slices, Loaf, Bread Loaf",52,15
4085,https://cdn.pixabay.com/photo/2022/02/10/05/44/breakfast-7004639__340.jpg,"Breakfast, Steamed Stuffed Bun",3,0
4086,https://cdn.pixabay.com/photo/2022/02/07/19/36/nature-7000146__340.jpg,"Nature, Sea, Outdoors, Ocean, Travel",9,3
4087,https://cdn.pixabay.com/photo/2020/04/20/20/47/red-5069808__480.jpg,"Red, Drop, Splash, Impact, Ripples",70,10
4088,https://cdn.pixabay.com/photo/2012/12/13/18/50/frog-69813__340.jpg,"Frog, Animal, Wildlife, Tree Frog",521,89
4089,https://cdn.pixabay.com/photo/2022/01/23/15/58/dog-6961180__340.jpg,"Dog, Boxer, Domestic, Attentive, Animal",22,1
4090,https://cdn.pixabay.com/photo/2021/11/17/09/50/christmas-decoration-6802963__340.jpg,"Christmas Decoration, Christmas Time",21,9
4091,https://cdn.pixabay.com/photo/2021/11/27/10/15/rhododendron-6827638__340.jpg,"Rhododendron, Flower, Purple Flower",42,63
4092,https://cdn.pixabay.com/photo/2022/03/06/13/48/flower-7051719__340.jpg,"Every donation goes to Aljona, Sasha and Christina, who survived Mariupol for 5 weeks and are now finally on their way to me in Germany. Спасибі",11,3
4093,https://cdn.pixabay.com/photo/2014/11/04/08/13/fly-agaric-516281__340.jpg,"Fly Agaric, Mushrooms, Wild Mushrooms",415,46
4094,https://cdn.pixabay.com/photo/2021/10/13/13/26/fire-6706674__340.jpg,"Fire, Field, Firefighter, Firefighting",4,2
4095,https://cdn.pixabay.com/photo/2022/01/07/06/54/canadian-goldenrod-6921221__340.jpg,"Canadian Goldenrod, Solidago Canadensis",38,35
4096,https://cdn.pixabay.com/photo/2017/08/18/16/31/template-2655556__340.jpg,"Template, Letter, Kraft, Dried Flowers",330,30
4097,https://cdn.pixabay.com/photo/2020/05/23/16/52/fantasy-5210417__340.jpg,"Fantasy, Wall, Dragon, Fire, Darling",128,79
4098,https://cdn.pixabay.com/photo/2022/02/08/10/32/bird-7001145__340.jpg,"Bird, Robin, Ornithology, Species, Fauna",13,13
4099,https://cdn.pixabay.com/photo/2022/03/02/15/28/swan-7043385__340.jpg,"Swan, Mute Swan, Bird, Waterfowl",9,9
4100,https://cdn.pixabay.com/photo/2022/03/11/03/14/orthodox-church-7061113__480.jpg,"Orthodox Church, Russia, Architecture",3,1
4101,https://cdn.pixabay.com/photo/2019/02/21/14/50/sky-4011511__340.jpg,"Darling, Moon, Night, Cabin, Lights",260,89
4102,https://cdn.pixabay.com/photo/2021/12/22/19/42/heather-6888135__340.jpg,"Heather, Plants, Forest, Nature",42,39
4103,https://cdn.pixabay.com/photo/2018/07/01/13/28/announcement-3509489__340.jpg,"Announcement, Article, Articles",90,29
4104,https://cdn.pixabay.com/photo/2022/03/22/01/13/pretty-7084158__340.jpg,"Pretty, Spaghetti, Vegetable",5,0
4105,https://cdn.pixabay.com/photo/2022/02/22/22/47/spring-snowflake-7029712__340.jpg,"Spring Snowflake, Flower, Plant",13,18
4106,https://cdn.pixabay.com/photo/2022/01/03/10/03/books-6912224__340.jpg,"Books, Library, Bookshelf, Old Books",3,0
4107,https://cdn.pixabay.com/photo/2022/03/07/05/16/lotus-7052950__340.jpg,"Lotus, Flower, Lotus Flower, Pink Flower",4,0
4108,https://cdn.pixabay.com/photo/2021/12/11/13/21/animal-6862712__340.jpg,"Animal, Reindeer, Snow, Christmas, Deer",6,2
4109,https://cdn.pixabay.com/photo/2022/02/05/13/15/flowers-6994806__340.jpg,"Flowers, Almond Blossoms, Pink Flowers",18,14
4110,https://cdn.pixabay.com/photo/2016/10/22/15/19/book-1760998__340.jpg,"A Book, Book Gift, Heart, Gift, Read",513,67
4111,https://cdn.pixabay.com/photo/2020/06/06/22/40/burning-5268446__340.jpg,"Burning, Earth, Heat, Global, Warming",40,10
4112,https://cdn.pixabay.com/photo/2022/01/02/22/35/reptile-6911355__340.jpg,"Reptile, Lizard, Wildlife, Species",15,5
4113,https://cdn.pixabay.com/photo/2019/04/08/16/49/blooming-4112348__340.jpg,"Blooming, Spring, Garden, Blossom",188,15
4114,https://cdn.pixabay.com/photo/2022/02/05/04/17/ballet-6994038__340.jpg,"Ballet, Dancer, Dance, Woma, Flexibility",6,0
4115,https://cdn.pixabay.com/photo/2017/08/24/06/29/coconut-2675546__480.jpg,"Coconut, Party, Several, Coconut",183,41
4116,https://cdn.pixabay.com/photo/2015/10/22/17/34/smoke-1001667__340.png,"Smoke, Swirls, Abstract, Smoking",272,34
4117,https://cdn.pixabay.com/photo/2022/02/22/13/33/man-7028805__340.jpg,"Man, Motorcycle, Rider, Helmet",1,0
4118,https://cdn.pixabay.com/photo/2021/12/16/08/19/dog-6874054__340.jpg,"Dog, French Bulldog, Christmas, Weary",20,15
4119,https://cdn.pixabay.com/photo/2021/09/04/09/33/mountains-6597408__340.jpg,"Mountains, Island, Sea, Ocean, Hike",16,5
4120,https://cdn.pixabay.com/photo/2022/02/27/08/41/grandparent-7036867__340.jpg,"Grandparent, Elderly, Mother, Family",2,2
4121,https://cdn.pixabay.com/photo/2022/03/01/19/44/background-7041901__340.jpg,"Background, Mountains, Stones, Dragon",2,3
4122,https://cdn.pixabay.com/photo/2022/02/20/22/19/trees-7025426__340.jpg,"Trees, Boardwalk, Lake, Forest",8,4
4123,https://cdn.pixabay.com/photo/2022/02/23/14/50/flowers-7030775__340.jpg,"Flowers, Crocus, Garden, Spring, Meadow",6,4
4124,https://cdn.pixabay.com/photo/2021/10/21/08/39/background-6728362__340.jpg,"Every donation goes to Aljona, Sasha and Christina, who survived Mariupol for 5 weeks and are now finally on their way to me in Germany. Спасибі",21,10
4125,https://cdn.pixabay.com/photo/2020/10/23/14/13/lake-5678837__480.jpg,"Lake, Forest, Trees, Pond, Water",103,19
4126,https://cdn.pixabay.com/photo/2022/03/17/17/10/cat-7075041__340.jpg,"Cat, Pet, Feline, Animal, Fur, Kitty",1,0
4127,https://cdn.pixabay.com/photo/2022/01/24/09/24/women-6962965__340.jpg,"Women, Hijab, Islam, Muslim, Shiite",4,0
4128,https://cdn.pixabay.com/photo/2022/02/09/19/29/mountain-7004086__340.jpg,"Mountain, Castle, Ruins, Fog, Mist",6,0
4129,https://cdn.pixabay.com/photo/2021/09/09/17/49/parrot-6611298__340.jpg,"Parrot, Era, Multicoloured",55,62
4130,https://cdn.pixabay.com/photo/2017/01/15/20/26/lantern-1982669__340.jpg,"Lantern, Candle, Light, Mood",492,68
4131,https://cdn.pixabay.com/photo/2022/03/21/16/05/nature-7083480__340.jpg,"Nature, Colorado, Trail, Hiking, Trees",0,0
4132,https://cdn.pixabay.com/photo/2022/03/10/08/43/deer-7059368__340.jpg,"Deer, Antler, Animal, Mammal, Nature",4,2
4133,https://cdn.pixabay.com/photo/2021/07/12/14/16/train-6406475__340.jpg,"Train, Railway Station, Mountains, Alps",63,70
4134,https://cdn.pixabay.com/photo/2020/09/05/14/01/kingfisher-5546610__340.jpg,"Kingfisher, Bird, Animal, Avian",131,56
4135,https://cdn.pixabay.com/photo/2022/02/17/22/53/flower-7019611__340.jpg,"Flower, Stamen, Corolla, Nature, Botany",18,34
4136,https://cdn.pixabay.com/photo/2021/10/02/07/30/violin-6674424__340.jpg,"Violin, Musical Notes, Music, Bow",16,9
4137,https://cdn.pixabay.com/photo/2021/11/12/12/52/sunflower-6788930__340.jpg,"Sunflower, Yellow Flower, Nature",12,1
4138,https://cdn.pixabay.com/photo/2022/03/11/10/56/couple-7061934__340.jpg,"Couple, Love, Romance, Together",1,0
4139,https://cdn.pixabay.com/photo/2021/10/08/20/45/cat-6692490__340.jpg,"Cat, Pet, Feline, Animal, Fur, Kitty",24,13
4140,https://cdn.pixabay.com/photo/2022/02/22/13/10/street-7028758__480.jpg,"Street, Puddle, Tram, City, Reflection",7,4
4141,https://cdn.pixabay.com/photo/2018/01/17/10/16/key-3087898__340.jpg,"Key, Heart, Daisy, Love, Wood",385,23
4142,https://cdn.pixabay.com/photo/2022/03/28/22/50/flower-7098486__340.jpg,"Flower, Daisy, Grass, Meadow, Plant",1,0
4143,https://cdn.pixabay.com/photo/2022/01/25/03/19/animal-6965193__340.jpg,"Animal, Monkeys, Mammal, Species, Fauna",8,5
4144,https://cdn.pixabay.com/photo/2020/09/26/07/19/grapes-5603367__340.jpg,"Grapes, Fruits, Grapevine, Vine",81,19
4145,https://cdn.pixabay.com/photo/2022/02/18/13/06/donut-7020625__340.jpg,"Donut, Chocolate, Dough, Sweet, Dessert",3,1
4146,https://cdn.pixabay.com/photo/2017/02/19/16/01/mountaineer-2080138__340.jpg,"Mountaineer, Blizzard, Mountain Climbing",351,60
4147,https://cdn.pixabay.com/photo/2018/06/08/01/19/mountains-3461451__340.jpg,"Mountains, Summit, Clouds, Swiss Jura",188,32
4148,https://cdn.pixabay.com/photo/2019/07/29/06/38/slimming-4370008__340.jpg,"Slimming, Diet, Health, Sugar",134,17
4149,https://cdn.pixabay.com/photo/2022/03/23/11/50/spring-7087015__340.jpg,"Spring, Flower, Blossom, Botany, Bloom",0,0
4150,https://cdn.pixabay.com/photo/2022/03/13/17/15/bird-7066444__340.jpg,"Bird, Pesquet'S Parrot, Ornithology",3,1
4151,https://cdn.pixabay.com/photo/2021/07/20/11/50/cornflower-6480492__340.jpg,"Cornflower, Field, Wheat Field, Meadow",64,64
4152,https://cdn.pixabay.com/photo/2022/02/19/09/59/women-7022200__340.jpg,"Women, Walking, City, City Life",7,1
4153,https://cdn.pixabay.com/photo/2021/08/11/17/03/bride-6538978__340.jpg,"Bride, Groom, Wedding",11,2
4154,https://cdn.pixabay.com/photo/2015/12/08/05/57/winter-wonderland-1082511__340.jpg,"Winter Wonderland, Red, Snow, Cold",500,73
4155,https://cdn.pixabay.com/photo/2022/03/18/04/05/pochard-7075848__480.jpg,"Pochard, Duck, Pond, Bird, Water Bird",10,18
4156,https://cdn.pixabay.com/photo/2016/11/22/07/09/spruce-1848543__340.jpg,"Spruce, Snow, Snowfall, Snowdrift",205,26
4157,https://cdn.pixabay.com/photo/2022/02/13/10/28/melon-7010810__340.jpg,"Melon, Fruit, Summer, Nature, Food",19,18
4158,https://cdn.pixabay.com/photo/2017/06/21/13/37/lizard-2427248__340.jpg,"Lizard, Reptile, Forest Dragon, Scaly",352,68
4159,https://cdn.pixabay.com/photo/2014/12/01/19/23/pink-553149__340.jpg,"Pink, Gifts, Boxes, Presents, Gift Boxes",470,77
4160,https://cdn.pixabay.com/photo/2016/08/12/03/51/notebook-1587525__340.jpg,"Notebook, Pen, Table, Blank, Desk, Paper",267,30
4161,https://cdn.pixabay.com/photo/2022/03/18/21/36/mushroo-7077503__340.jpg,"Mushroo, Plant, Toadstool, Fungus",2,0
4162,https://cdn.pixabay.com/photo/2015/04/25/12/39/girls-739071__340.jpg,"Girls, Children, Tulips, Red Tulips",474,63
4163,https://cdn.pixabay.com/photo/2022/03/05/13/32/crocus-7049217__340.jpg,"Crocus, Flowers, Plants, Petals, Bloom",9,4
4164,https://cdn.pixabay.com/photo/2021/08/19/08/35/handshake-6557378__340.jpg,None,7,1
4165,https://cdn.pixabay.com/photo/2022/02/08/10/59/panda-7001161__340.jpg,"Panda, Red Panda, Mammal, Forest, Nature",4,3
4166,https://cdn.pixabay.com/photo/2022/02/12/19/28/paragliding-7009737__340.jpg,"Paragliding, Free Flight, Seaside",19,18
4167,https://cdn.pixabay.com/photo/2020/12/18/05/59/beer-5841255__340.jpg,"Beer, Foam, Pint, Glass, Ale, Alcohol",32,14
4168,https://cdn.pixabay.com/photo/2021/04/28/20/54/speech-balloon-6214960__340.jpg,"Speech Balloon, Communication, Comic",10,2
4169,https://cdn.pixabay.com/photo/2020/10/17/10/11/bicycles-5661632__340.jpg,"Bicycles, Cyclists, Cycling, Sports",18,7
4170,https://cdn.pixabay.com/photo/2015/02/28/11/47/forest-653448__480.jpg,"Forest, Trees, Light, Dust, Clearing",250,31
4171,https://cdn.pixabay.com/photo/2022/01/08/13/43/dwarf-6924016__340.jpg,"Dwarf, Gnomes, Christmas, Elves, Decor",24,19
4172,https://cdn.pixabay.com/photo/2017/07/31/23/38/video-2562034__340.jpg,"Video, Camera, Optics, Photography",157,25
4173,https://cdn.pixabay.com/photo/2018/06/15/23/27/cherries-3477927__340.jpg,"Cherries, Fruit, Food, Bio, Fresh",245,78
4174,https://cdn.pixabay.com/photo/2022/02/14/08/02/plant-7012666__340.jpg,"Plant, Growth, Organic",19,28
4175,https://cdn.pixabay.com/photo/2016/08/12/00/51/doors-1587329__340.jpg,"Doors, Choices, Choose, Open, Decision",333,62
4176,https://cdn.pixabay.com/photo/2021/11/05/09/48/pico-ruivo-6770879__340.jpg,"Pico Ruivo, Peak, Mountain, Fog, Madeira",11,0
4177,https://cdn.pixabay.com/photo/2016/12/19/12/08/ginger-1918107__340.jpg,"Ginger, Hot Lemon, Tea, Lemon, Snow",246,45
4178,https://cdn.pixabay.com/photo/2020/10/06/12/16/kuthodaw-pagoda-5632067__340.jpg,"Kuthodaw Pagoda, Temple, City, Pagoda",82,10
4179,https://cdn.pixabay.com/photo/2021/12/11/16/42/waves-6863157__340.jpg,"Waves, Outdoors, Sea, Seascape, Ocean",17,5
4180,https://cdn.pixabay.com/photo/2022/03/12/14/47/moss-7064320__340.jpg,"Moss, Forest, Lichen, Nature, Close Up",4,2
4181,https://cdn.pixabay.com/photo/2022/03/20/10/52/sparrow-7080537__340.jpg,"Sparrow, Bird, Perched, Animal, Feathers",1,1
4182,https://cdn.pixabay.com/photo/2022/03/13/04/10/monkeys-7065229__340.jpg,"Monkeys, Animls, Primate, Mammals",2,0
4183,https://cdn.pixabay.com/photo/2020/04/01/16/51/background-4991824__340.jpg,"Background, Nature, Moonlight, Emotion",161,59
4184,https://cdn.pixabay.com/photo/2020/04/03/14/05/african-elephant-4999036__480.jpg,"African Elephant, Africa, Botswana",41,10
4185,https://cdn.pixabay.com/photo/2022/03/04/13/01/child-7047288__340.jpg,"Child, Kid, Learning, Education",1,0
4186,https://cdn.pixabay.com/photo/2016/08/07/11/30/bellflower-1576086__340.jpg,"Bellflower, Blue Flower, Petals",452,85
4187,https://cdn.pixabay.com/photo/2022/03/07/02/11/hallway-7052825__340.jpg,"Hallway, Corridor, Door, Room, Home",0,0
4188,https://cdn.pixabay.com/photo/2016/01/31/15/22/mother-1171569__340.jpg,"Mother, Daughter, Family, Park, Child",263,28
4189,https://cdn.pixabay.com/photo/2018/01/05/16/24/rose-3063283__340.jpg,"Rose, Flower, Petal, Floral, Love",230,53
4190,https://cdn.pixabay.com/photo/2022/03/08/17/25/desert-7056224__340.jpg,"Desert, Sand, Dunes, Sunrise, Nature",4,0
4191,https://cdn.pixabay.com/photo/2022/02/02/02/15/cowboy-6987389__340.jpg,"Cowboy, Rodeo Horse, Horse, Hat, Animal",2,2
4192,https://cdn.pixabay.com/photo/2017/01/04/20/15/web-design-1953128__340.jpg,"Web Design, Facebook, Facebook Page",219,32
4193,https://cdn.pixabay.com/photo/2017/11/08/12/04/war-2930223__340.jpg,"War, Destruction, Despair, Fear",183,32
4194,https://cdn.pixabay.com/photo/2022/02/22/10/49/caves-7028437__340.jpg,"Caves, Exploration, Light Beams",6,1
4195,https://cdn.pixabay.com/photo/2017/09/07/08/57/drone-2724257__340.jpg,"Drone, Flying Drone, Quadrocopter, Hobby",317,41
4196,https://cdn.pixabay.com/photo/2021/11/08/13/59/dogs-6779165__340.jpg,"Dogs, Fight, Canine, Mammals, Animals",17,13
4197,https://cdn.pixabay.com/photo/2019/09/22/12/37/grapes-4495944__340.jpg,"Grapes, Ripe, Harvest, Wine, Fruit, Cute",128,54
4198,https://cdn.pixabay.com/photo/2022/01/17/15/52/food-6945117__480.jpg,"Food, Sandwich, Bread, Chicken, Dish",44,41
