,img_link,tags,likes,comments
1253,https://cdn.pixabay.com/photo/2022/03/16/17/18/almond-blossom-7072869__340.jpg,"Almond Blossom, Almond Tree, Spring",28,20
1254,https://cdn.pixabay.com/photo/2017/03/13/17/26/ecommerce-2140604__340.jpg,"Ecommerce, Selling Online, Online Sales",545,144
1255,https://cdn.pixabay.com/photo/2020/11/07/09/45/space-5720414__340.jpg,"Space, Planet, Stars, Cosmos, Sci-Fi",65,14
1256,https://cdn.pixabay.com/photo/2022/03/31/11/47/flowers-7102844__340.jpg,"Flowers, Quince, Botany, Bloom, Blossom",3,0
1257,https://cdn.pixabay.com/photo/2022/04/02/13/16/cherry-blossoms-7107003__340.jpg,"Cherry Blossoms, Pink Flowers, Spring",6,2
1258,https://cdn.pixabay.com/photo/2021/08/28/08/47/water-splash-6580409__340.jpg,"Water Splash, Crown, Diamonds, Water",27,8
1259,https://cdn.pixabay.com/photo/2014/08/05/10/30/iphone-410324__340.jpg,"Iphone, Smartphone, Apps, Apple Inc",749,194
1260,https://cdn.pixabay.com/photo/2022/03/25/18/48/cat-7091599__340.jpg,"Cat, Pet, Animal, Feline, Domestic Cat",8,2
1261,https://cdn.pixabay.com/photo/2020/10/09/21/03/buddha-5641534__480.jpg,"Buddha, Statue, Thailand, Buddhism",142,24
1262,https://cdn.pixabay.com/photo/2017/03/11/17/49/maple-2135514__340.jpg,"Maple, Fall, Multicoloured, Nature",686,105
1263,https://cdn.pixabay.com/photo/2022/03/30/12/04/magnolia-7101076__340.jpg,"Magnolia, Flower Bud, Spring, Nature",13,5
1264,https://cdn.pixabay.com/photo/2022/04/01/14/26/crocuses-7104928__340.jpg,"Crocuses, White Crocuses, White Flowers",8,5
1265,https://cdn.pixabay.com/photo/2022/02/27/09/59/landscape-7036976__340.jpg,"Landscape, Mountain, Nature, Sky, Travel",44,42
1266,https://cdn.pixabay.com/photo/2021/06/09/20/27/stars-6324434__340.jpg,"Stars, Night, Astrophotography, Nature",54,5
1267,https://cdn.pixabay.com/photo/2022/02/19/09/59/fantasy-7022197__340.jpg,"Fantasy, Lake, Sunset, Sky, Colorful Sky",5,1
1268,https://cdn.pixabay.com/photo/2022/02/28/08/18/render-7038732__340.jpg,"Render, Rendering, 3D, 3D Animation",2,1
1269,https://cdn.pixabay.com/photo/2021/08/13/14/23/animal-6543231__340.jpg,"Animal, Warthog, Mammal, Species, Pig",40,15
1270,https://cdn.pixabay.com/photo/2022/02/10/05/43/ancient-town-7004632__340.jpg,"Ancient Town, Street, Asia",8,2
1271,https://cdn.pixabay.com/photo/2022/04/05/12/56/winter-7113508__340.jpg,"Winter, Snow, Chapel, Landscape",1,0
1272,https://cdn.pixabay.com/photo/2022/03/25/19/36/blackthorn-7091649__340.jpg,"Blackthorn, Flowers, Tree, White Flowers",9,5
1273,https://cdn.pixabay.com/photo/2017/03/20/21/00/server-2160321__340.jpg,"Server, Space, The Server Room, Dark",522,134
1274,https://cdn.pixabay.com/photo/2020/09/18/21/12/person-5582976__340.jpg,"Person, Child, Book, Sitting, Grass",80,20
1275,https://cdn.pixabay.com/photo/2022/03/27/16/06/animal-7095530__340.jpg,"Animal, Bear, North Pole, Wildlife",5,0
1276,https://cdn.pixabay.com/photo/2020/06/05/16/18/meadow-5263664__480.jpg,"Meadow, Grass, Tree, Landscape, Summer",232,42
1277,https://cdn.pixabay.com/photo/2021/07/19/14/27/persian-6478261__340.jpg,"Persian, Cat, Pet, Feline, Animal, Fur",35,9
1278,https://cdn.pixabay.com/photo/2021/09/09/08/02/shipwreck-6609824__340.jpg,"Shipwreck, Ocean, Thunderstorm, Sea",59,41
1279,https://cdn.pixabay.com/photo/2022/04/08/13/27/cat-7119496__340.jpg,"Cat, Pet, Animal, Roses, Bokeh, Nature",1,0
1280,https://cdn.pixabay.com/photo/2022/04/05/05/27/man-7112817__340.jpg,"Man, Portrait, Forest, Landscape, Snow",4,0
1281,https://cdn.pixabay.com/photo/2022/02/22/11/00/pate-7028475__340.jpg,"Pate, Starters, Canapes, Hors D'Oeuvres",46,39
1282,https://cdn.pixabay.com/photo/2021/11/13/13/06/tea-6791234__340.jpg,"Tea, Honey Candy, Cup, Drink, Cinnamon",31,13
1283,https://cdn.pixabay.com/photo/2022/04/02/10/13/sprigs-7106647__340.jpg,"Sprigs, Trees, Leaves, Spring, Nature",1,0
1284,https://cdn.pixabay.com/photo/2021/06/29/23/05/poppy-6375453__340.jpg,"Poppy, Flower, Red Poppy, Red Flower",84,33
1285,https://cdn.pixabay.com/photo/2022/03/08/18/57/flower-7056373__340.jpg,"Flower, Crocus, Spring, Bloom, Blossom",33,24
1286,https://cdn.pixabay.com/photo/2022/04/05/18/49/animal-7114226__340.jpg,"Animal, Cat, Feline, Stray, Wild, Mammal",5,2
1287,https://cdn.pixabay.com/photo/2022/02/15/08/01/city-7014478__340.jpg,"City, Travel, Tourism, Urban, Skyline",3,0
1288,https://cdn.pixabay.com/photo/2022/03/22/19/07/flower-7085772__340.png,"Flower, Tulips, Botany, Bloom, Blossom",4,0
1289,https://cdn.pixabay.com/photo/2021/12/20/00/06/christmas-6882089__340.jpg,"Christmas, Balls, Wish, Decoration",55,62
1290,https://cdn.pixabay.com/photo/2021/09/07/13/26/window-6603969__340.jpg,"Window, Flowers, Glass, Facade, Home",100,68
1291,https://cdn.pixabay.com/photo/2020/06/14/10/58/london-5297395__480.jpg,"London, Sunset, England, Architecture",146,29
1292,https://cdn.pixabay.com/photo/2020/05/11/18/37/forest-5159688__340.jpg,"Forest, Trees, Mystical, Light, Mood",528,86
1293,https://cdn.pixabay.com/photo/2013/08/28/11/47/leaf-176722__340.jpg,green leaf,736,157
1294,https://cdn.pixabay.com/photo/2021/07/31/13/31/dry-rose-6511985__340.jpg,"Dry Rose, Sheet Music, Piano, Music",35,10
1295,https://cdn.pixabay.com/photo/2022/03/25/19/42/crocus-7091657__340.jpg,"Crocus, Pistils, Blossom, Bloom",17,18
1296,https://cdn.pixabay.com/photo/2016/02/01/16/10/eye-1173863__340.jpg,"Eye, Blue Eye, Iris, Pupil, Eyeball",946,138
1297,https://cdn.pixabay.com/photo/2022/02/03/20/54/peppers-6991349__340.jpg,"Peppers, Vegetables, Food, Organic",38,53
1298,https://cdn.pixabay.com/photo/2017/04/25/05/14/samurai-2258604__340.jpg,"Samurai, Silhouette Art, Lone Warrior",441,49
1299,https://cdn.pixabay.com/photo/2022/03/24/08/31/animal-7088603__340.jpg,"„Ich schau dir in die Augen, Kleines! “",12,10
1300,https://cdn.pixabay.com/photo/2022/04/01/22/34/bay-breasted-warbler-7105836__340.jpg,"Bay-Breasted Warbler, Bird, Branch",3,3
1301,https://cdn.pixabay.com/photo/2021/07/07/04/56/amsterdam-6393230__340.jpg,"Amsterdam, Netherlands, Canal, Boats",49,10
1302,https://cdn.pixabay.com/photo/2022/03/28/20/02/bird-7098252__340.jpg,"Bird, Eurasian Blue Tit, Wildlife, Avian",9,0
1303,https://cdn.pixabay.com/photo/2022/03/08/18/05/house-7056279__340.jpg,"House, Windows, Facade, Ivy",36,45
1304,https://cdn.pixabay.com/photo/2020/05/11/17/19/countryside-5159278__340.jpg,"Countryside, Pasture, Sky, Agriculture",116,36
1305,https://cdn.pixabay.com/photo/2021/03/18/19/56/keyboard-6105750__480.jpg,"Keyboard, Computer, Laptop, Technology",77,61
1306,https://cdn.pixabay.com/photo/2019/08/27/03/17/bird-skull-4433244__340.jpg,"Bird Skull, Skull, Creepy, Valravn, Dark",300,36
1307,https://cdn.pixabay.com/photo/2022/01/03/19/28/castle-6913460__340.jpg,"Castle, Smartphone, Iphone",13,3
1308,https://cdn.pixabay.com/photo/2022/03/21/07/44/forget-me-not-7082502__340.jpg,"Forget-Me-Not, Flowers, Blue Flowers",20,19
1309,https://cdn.pixabay.com/photo/2022/01/19/10/38/t-rex-6949438__340.jpg,Tyrannosaurus Rex - [Software: Gimp 2.10.24],26,23
1310,https://cdn.pixabay.com/photo/2022/03/06/18/54/daffodils-7052308__340.jpg,"Daffodils, Easter Bell, Flower",26,25
1311,https://cdn.pixabay.com/photo/2022/04/04/21/00/nature-7112416__340.jpg,"Nature, Travel, Exploration, Outdoors",2,0
1312,https://cdn.pixabay.com/photo/2022/03/27/19/06/birds-7095904__340.jpg,"Birds, Goose, Ornithology, Species",9,5
1313,https://cdn.pixabay.com/photo/2020/11/22/08/06/forest-5765878__340.jpg,"Forest, Trees, Sunlight, Silhouette",194,34
1314,https://cdn.pixabay.com/photo/2022/02/22/16/45/sea-7029192__340.jpg,"Sea, Cliffs, Rock Formations, Mountains",45,45
1315,https://cdn.pixabay.com/photo/2022/03/29/18/46/flowers-7099966__340.jpg,Keukenhof,8,3
1316,https://cdn.pixabay.com/photo/2021/06/30/08/13/flower-6376162__340.jpg,"Flower, Daisy, Legs, Baby, Kid, Barefoot",66,19
1317,https://cdn.pixabay.com/photo/2021/11/07/21/21/barn-6777934__340.jpg,"Barn, Farm, Foothills, Landscape",27,5
1318,https://cdn.pixabay.com/photo/2019/05/14/16/43/himilayan-blue-poppy-4202825__480.jpg,"Himilayan Blue Poppy, Flower, Petals",479,84
1319,https://cdn.pixabay.com/photo/2022/01/23/16/03/squirrel-6961223__340.jpg,"Squirrel, Rodent, Animal, Red Squirrel",52,12
1320,https://cdn.pixabay.com/photo/2022/04/03/09/03/beach-7108426__340.jpg,"Beach, Sunset, Island, Florida, Sea",3,0
1321,https://cdn.pixabay.com/photo/2020/12/18/19/11/teenager-5842706__340.jpg,"Teenager, Hoodie, Hand, No, Gesture",103,20
1322,https://cdn.pixabay.com/photo/2017/03/27/21/31/money-2180330__340.jpg,"Money, Coins, Stack, Stacked Coins",556,102
1323,https://cdn.pixabay.com/photo/2021/03/22/22/06/couple-6115830__340.jpg,"Couple, Romantic, Galaxy, Universe",52,9
1324,https://cdn.pixabay.com/photo/2022/03/25/02/44/plum-blossom-7090170__340.jpg,"Plum Blossom, Flowers, Branch, Spring",7,10
1325,https://cdn.pixabay.com/photo/2022/02/25/23/40/bokeh-7034993__340.jpg,"Bokeh, Blur, Lights, Design, Art",29,48
1326,https://cdn.pixabay.com/photo/2022/03/31/16/07/beach-7103318__340.jpg,"Beach, Sea, Sky, Clouds, Seascape, Waves",4,2
1327,https://cdn.pixabay.com/photo/2022/03/19/11/40/almond-blossom-7078360__340.jpg,"Almond Blossom, Petals, Almond Tree",19,16
1328,https://cdn.pixabay.com/photo/2018/10/14/13/01/ruin-3746423__340.jpg,"Ruin, Castle, Middle Ages, Dramatic",638,128
1329,https://cdn.pixabay.com/photo/2021/11/05/13/15/lavaux-6771369__340.jpg,"Lavaux, Lake Geneva, Switzerland",76,73
1330,https://cdn.pixabay.com/photo/2022/04/07/16/36/art-7117925__340.jpg,"Art, Paint, Scene, Nft, Metaverse, Stars",2,0
1331,https://cdn.pixabay.com/photo/2022/04/05/10/20/flowers-7113283__340.jpg,"Flowers, Plants, Nature, Leaves, Grass",1,0
1332,https://cdn.pixabay.com/photo/2021/09/11/13/08/shoes-6615585__480.jpg,"Shoes, Girl, Baby, Fashion, Little Shoes",47,10
1333,https://cdn.pixabay.com/photo/2020/04/10/12/26/nature-5025558__340.jpg,"Nature, Waters, Lake, Landscape, Eve",140,19
1334,https://cdn.pixabay.com/photo/2022/03/25/04/09/magnolia-7090262__340.jpg,"Magnolia, Flower, Branch, Spring, Tree",16,14
1335,https://cdn.pixabay.com/photo/2022/04/02/08/13/geese-7106517__340.jpg,"Geese, Flying Geese, Lake, Birds, Nature",2,0
1336,https://cdn.pixabay.com/photo/2016/02/10/16/37/cat-1192026__340.jpg,"Cat, Kitten, Pet, Striped, Young, Feline",787,103
1337,https://cdn.pixabay.com/photo/2022/02/15/15/24/drink-7015149__340.jpg,"Drink, Milk, Glass, Refreshment",12,8
1338,https://cdn.pixabay.com/photo/2022/04/02/13/14/mountains-7106980__340.jpg,"Mountains, Brazil, Landscape, Nature",3,2
1339,https://cdn.pixabay.com/photo/2022/03/29/22/24/flowers-7100271__340.jpg,"Flowers, Corn Milk, Spring Flowers",3,0
1340,https://cdn.pixabay.com/photo/2022/02/24/16/55/duck-7032776__340.jpg,"Duck, Mandarin Duck, Bird, Waterfowl",28,24
1341,https://cdn.pixabay.com/photo/2022/04/03/19/17/kid-7109737__340.jpg,"Kid, Bust, Eyes, Knowledge",4,1
1342,https://cdn.pixabay.com/photo/2021/08/26/17/12/city-6576686__340.jpg,"City, Urban, Monochrome, Travel",30,11
1343,https://cdn.pixabay.com/photo/2022/04/06/07/21/flowers-7114989__340.jpg,"Flowers, Spring, Cherry Blossom, Tree",0,0
1344,https://cdn.pixabay.com/photo/2022/04/04/13/53/plum-blossoms-7111359__340.jpg,"Plum Blossoms, Changdeokgung Palace",2,1
1345,https://cdn.pixabay.com/photo/2022/04/01/18/31/cyprus-7105435__340.jpg,"Cyprus, Paralimni, Town, View, Lake",2,0
1346,https://cdn.pixabay.com/photo/2021/06/14/08/55/lotus-6335296__340.jpg,"Lotus, Flower, Water Lily, White Flower",83,22
1347,https://cdn.pixabay.com/photo/2018/10/28/12/37/bedroom-3778695__340.jpg,"Bedroom, Interior, Design, Style",305,61
1348,https://cdn.pixabay.com/photo/2022/01/22/21/59/sky-6959300__480.jpg,"Sky, Clouds, Sea, Island, Coast, Ocean",76,73
1349,https://cdn.pixabay.com/photo/2022/03/18/05/22/flowers-7075910__340.jpg,"Flowers, Bloom, Botany, Blossom, Petals",15,28
1350,https://cdn.pixabay.com/photo/2022/03/12/20/57/ss-rotterdam-7064891__340.jpg,"Ss Rotterdam, Cruise Ship, Ocean Liner",15,12
1351,https://cdn.pixabay.com/photo/2020/10/11/09/04/peak-5645235__340.jpg,"Peak, Summit, Mountains, Snow Mountains",179,32
1352,https://cdn.pixabay.com/photo/2022/03/25/04/13/peach-blossom-7090264__340.jpg,"Peach Blossom, Flower, Branch, Spring",11,10
1353,https://cdn.pixabay.com/photo/2022/03/12/15/35/grass-7064408__340.jpg,"Grass, Green Grass, Grassland, Meadow",34,35
1354,https://cdn.pixabay.com/photo/2021/01/07/22/15/dandelion-5898546__340.jpg,"Dandelion, Glass, Seeds, Preserve",234,40
1355,https://cdn.pixabay.com/photo/2017/03/19/01/43/living-room-2155376__340.jpg,"Living Room, Chair, Sofa, Couch, Home",461,78
1356,https://cdn.pixabay.com/photo/2021/11/04/16/54/sky-6768714__340.jpg,"Sky, Aviation, Airplane, Aircraft",16,3
1357,https://cdn.pixabay.com/photo/2020/02/01/17/51/mountain-4810958__340.jpg,"Mountain, Rock, Peak, Clouds, Sea, Wave",252,53
1358,https://cdn.pixabay.com/photo/2022/03/27/07/41/scarce-swallowtail-7094261__340.jpg,"Scarce Swallowtail, Butterfly, Insect",7,6
1359,https://cdn.pixabay.com/photo/2017/06/15/16/50/panorama-2405958__340.jpg,"Panorama, Rural, Landscape, Agriculture",667,113
1360,https://cdn.pixabay.com/photo/2022/03/31/10/13/pear-7102711__340.jpg,"Hey, did you happen to see the most beautiful pear in the world?",14,7
1361,https://cdn.pixabay.com/photo/2016/02/07/21/03/computer-1185626__340.jpg,"Computer, Pc, Workplace, Home Office",760,102
1362,https://cdn.pixabay.com/photo/2020/03/05/20/37/flower-4905417__340.jpg,"Flower, Vase, Baby'S Breath, Natural",210,57
1363,https://cdn.pixabay.com/photo/2022/04/03/10/14/countryside-7108552__340.jpg,"Countryside, Field, Windmills",2,0
1364,https://cdn.pixabay.com/photo/2022/04/07/20/35/old-town-7118246__480.jpg,"stone, structure, part of the city, antiquity, descending perspective, terrace, overcast sky, contrast of warm and cold, ancient buildings, landmark, and historical places, Spain, travel, tourism, europe, ancient, antiquity, architecture, building, toledo",1,0
1365,https://cdn.pixabay.com/photo/2022/04/06/07/19/cherry-blossoms-7114970__340.jpg,"Cherry Blossoms, Sakura, Flowers, Nature",0,0
1366,https://cdn.pixabay.com/photo/2022/04/03/07/49/expression-7108278__340.jpg,"Expression, Cry, Laugh, Man, Student",1,0
1367,https://cdn.pixabay.com/photo/2017/12/30/09/07/a-3049571__340.jpg,"A, People, Naked, Girl, Adult, Nude",745,59
1368,https://cdn.pixabay.com/photo/2022/01/30/10/15/alpaca-6980347__340.jpg,"Alpaca, Animal, Farm Animal",52,79
1369,https://cdn.pixabay.com/photo/2022/04/08/08/17/drink-7118988__340.jpg,"Drink, Cocktail, Bar, Club, Mocktail",1,0
1370,https://cdn.pixabay.com/photo/2017/11/24/10/43/ticket-2974645__340.jpg,"Ticket, Coupon, Admission, Carnival",541,64
1371,https://cdn.pixabay.com/photo/2022/03/01/09/13/mallard-7040868__340.jpg,Add a description (optional),45,43
1372,https://cdn.pixabay.com/photo/2016/04/15/21/39/paper-1332019__340.jpg,"Paper, White, Gray, Handmade, Laid Paper",490,98
1373,https://cdn.pixabay.com/photo/2021/03/04/07/31/mountains-6067150__340.jpg,"Mountains, Lake, Reflection, Fjord",152,25
1374,https://cdn.pixabay.com/photo/2022/03/27/15/16/seedling-7095397__340.jpg,"Seedling, Flower Buds, Blossoms, Bloom",7,4
1375,https://cdn.pixabay.com/photo/2017/09/04/18/39/coffee-2714970__340.jpg,"Coffee, Coffee Cup, Cup, Drink, Beans",771,127
1376,https://cdn.pixabay.com/photo/2022/03/24/08/28/animal-7088594__340.jpg,Lebensfreude,14,12
1377,https://cdn.pixabay.com/photo/2022/04/04/13/54/city-7111375__480.jpg,"City, Seoul, Sunset, Landscape, Sundown",2,0
1378,https://cdn.pixabay.com/photo/2021/10/13/15/43/boy-6706970__340.jpg,"Boy, Child, Shelter, House, Kid",34,11
1379,https://cdn.pixabay.com/photo/2022/02/24/21/04/flower-7033155__340.jpg,"Flower, Blossom, Bloom, Botany, Petals",48,46
1380,https://cdn.pixabay.com/photo/2018/02/15/10/14/sky-3154857__340.jpg,"Heaven, Travel, Snow, Statue, Sculpture",531,144
1381,https://cdn.pixabay.com/photo/2022/04/01/18/43/bird-7105454__340.jpg,"Bird, Black-Headed Gull, Ornithology",1,0
1382,https://cdn.pixabay.com/photo/2016/11/29/08/51/city-1868530__340.jpg,"City, Man, Person, Solo, Window, Alone",652,100
1383,https://cdn.pixabay.com/photo/2020/01/27/10/24/pollution-4796858__340.jpg,"Pollution, Environment, Drone, Aerial",76,19
1384,https://cdn.pixabay.com/photo/2019/07/25/06/51/thuja-4361821__340.jpg,"Thuja, Summer, Drops, Water, Plant",167,37
1385,https://cdn.pixabay.com/photo/2019/11/11/15/32/coffee-4618705__340.jpg,"Coffee, Cup, Caffeine, Espresso",179,35
1386,https://cdn.pixabay.com/photo/2018/06/30/17/02/model-3508004__340.jpg,"Model, Portrait, Lingerie, Sexy, Lying",446,24
1387,https://cdn.pixabay.com/photo/2022/03/31/11/05/lime-butterfly-7102782__340.jpg,"Lime Butterfly, Butterfly, Insect, Wings",2,0
1388,https://cdn.pixabay.com/photo/2020/01/01/14/59/person-4733756__340.jpg,"Person, Man, Boy, Sunset, Twilight",88,30
1389,https://cdn.pixabay.com/photo/2022/02/15/09/53/cosmetics-7014585__340.jpg,"Cosmetics, Makeup, Makeup Brushes",5,1
1390,https://cdn.pixabay.com/photo/2018/03/13/02/43/eye-3221498__340.jpg,"Eye, Iris, Pupil, Vision, Eyeball",647,100
1391,https://cdn.pixabay.com/photo/2017/05/10/15/05/himalayas-2301040__340.jpg,"Himalayas, Mountains, Stars, Sky, Clouds",525,71
1392,https://cdn.pixabay.com/photo/2014/09/24/14/29/macbook-459196__480.jpg,"Macbook, Laptop, Google, Display, Screen",701,198
1393,https://cdn.pixabay.com/photo/2018/12/04/22/38/road-3856796__340.jpg,"Road, Nevada, Clouds, Bird, Landscape",524,104
1394,https://cdn.pixabay.com/photo/2020/12/14/17/40/studying-5831644__340.jpg,"Studying, Teacher, Students, Sunset",80,24
1395,https://cdn.pixabay.com/photo/2014/08/11/11/50/moon-415501__340.jpg,"Moon, Full Moon, Night, Dark, Lunar",998,173
1396,https://cdn.pixabay.com/photo/2020/06/02/04/13/nude-5249289__340.jpg,"Nude, Model, Body, Naked, Girl, Erotic",224,11
1397,https://cdn.pixabay.com/photo/2018/10/10/14/35/picture-frame-3737438__340.jpg,"Picture Frame, Flower, Orchid",339,76
1398,https://cdn.pixabay.com/photo/2022/03/26/16/04/bird-7093163__340.jpg,"Bird, Laughing Kookaburra, Ornithology",17,12
1399,https://cdn.pixabay.com/photo/2022/02/07/21/01/boat-7000270__340.jpg,"Boat, Wreck, Shipwreck, Abandoned",18,6
1400,https://cdn.pixabay.com/photo/2022/03/18/13/13/sunset-7076676__340.jpg,"Sunset, Nature, Dusk, Outdoors, Travel",4,3
1401,https://cdn.pixabay.com/photo/2022/02/26/05/13/green-veined-white-butterfly-7035225__340.jpg,"Green-Veined White Butterfly, Butterfly",48,42
1402,https://cdn.pixabay.com/photo/2021/05/25/12/59/mountain-6282389__340.jpg,"Mountain, Road, Sea, Trees, Forest, Sky",145,82
1403,https://cdn.pixabay.com/photo/2022/04/02/13/15/snail-7106991__340.jpg,"Snail, Plants, Invasive Species",8,1
1404,https://cdn.pixabay.com/photo/2021/04/19/11/14/snail-6191155__340.jpg,"Snail, Shell, Mollusk, Snail Shell",114,23
1405,https://cdn.pixabay.com/photo/2022/04/04/05/59/cross-7110417__340.jpg,Add a description (optional),10,3
1406,https://cdn.pixabay.com/photo/2022/03/27/10/22/city-7094641__480.jpg,"City, Skyscrapers, Frankfurt, Germany",4,0
1407,https://cdn.pixabay.com/photo/2019/12/26/11/04/golden-4720210__340.jpg,"Golden, Background, Sylvester",213,61
1408,https://cdn.pixabay.com/photo/2016/10/12/02/56/girl-1733352__340.jpg,"Girl, Sleep, Lying Down, Dog, Pet, Owner",969,119
1409,https://cdn.pixabay.com/photo/2018/02/04/13/51/night-3129908__340.jpg,"Night, Castle, Crow, Fantasy, Cloud",497,45
1410,https://cdn.pixabay.com/photo/2022/01/11/16/16/forest-6930996__340.jpg,"Forest, Snow, Nature, Trees, Winter, Fog",68,66
1411,https://cdn.pixabay.com/photo/2017/08/07/07/48/couple-2601156__340.jpg,"Couple, Hugging, Outdoors, Grass, People",496,65
1412,https://cdn.pixabay.com/photo/2019/03/12/20/27/kanban-4051777__340.jpg,"Kanban, Work, Work Process, To Organize",384,74
1413,https://cdn.pixabay.com/photo/2022/04/07/16/36/art-7117921__340.jpg,"Art, Paint, Scene, Nft, Metaverse, Stars",3,0
1414,https://cdn.pixabay.com/photo/2021/08/25/16/33/animal-6573941__340.jpg,"Animal, Squirrel, Mammal, Species",75,44
1415,https://cdn.pixabay.com/photo/2022/04/04/09/54/butterfly-7110774__340.jpg,"Butterfly, Polyenidae, Nature, Insect",2,0
1416,https://cdn.pixabay.com/photo/2021/11/10/20/03/microphone-6784742__340.jpg,"Microphone, Mic, Music, Sound, Audio",11,1
1417,https://cdn.pixabay.com/photo/2020/10/04/09/57/bird-feather-5625806__340.jpg,"Bird Feather, Feather, Plume, Lightness",201,42
1418,https://cdn.pixabay.com/photo/2022/02/23/15/45/portrait-7030878__340.jpg,"Portrait, Yellow Shirt, Beauty, Model",5,3
1419,https://cdn.pixabay.com/photo/2022/03/10/18/41/gull-7060518__480.jpg,"Gull, Bird, Flying, Wings, Animal",28,32
1420,https://cdn.pixabay.com/photo/2022/04/02/10/32/sea-7106683__340.jpg,Etangs d&#39;Asciaghju - Porto-Vecchio - Corsica,2,0
1421,https://cdn.pixabay.com/photo/2021/08/27/08/21/video-game-6578106__340.jpg,"Video Game, Entertainment, Boy",18,7
1422,https://cdn.pixabay.com/photo/2021/01/07/14/19/vaccine-5897391__340.jpg,"Vaccine, Cure, Medicine, Virus, Covid-19",44,12
1423,https://cdn.pixabay.com/photo/2022/04/07/16/08/moon-7117836__340.jpg,"Moon, Full Moon, Sky, Night, Astronomy",1,0
1424,https://cdn.pixabay.com/photo/2022/01/14/23/06/yachts-6938309__340.jpg,"Yachts, Boats, Sunset, Marine, Wharf",85,83
1425,https://cdn.pixabay.com/photo/2022/03/27/13/11/map-7095042__340.jpg,"Map, Map Of Brazil, Brazil, Wallpaper",1,0
1426,https://cdn.pixabay.com/photo/2022/03/13/14/28/sofa-7066157__340.jpg,"Sofa, Book, Living Room, Interior, Table",5,1
1427,https://cdn.pixabay.com/photo/2017/04/07/21/22/waves-2211925__340.jpg,"Waves, Smashing, Sea, Ocean, Ocean Waves",864,98
1428,https://cdn.pixabay.com/photo/2022/02/26/15/04/mushrooms-7035893__340.jpg,"Mushrooms, Nature, Mycology, Fungus",24,22
1429,https://cdn.pixabay.com/photo/2019/09/23/04/50/jellyfish-4497496__340.jpg,"Jellyfish, Medusa, Sea, Jelly, Lilac",141,14
1430,https://cdn.pixabay.com/photo/2022/01/30/13/13/astronomy-6980859__340.jpg,"Astronomy, Sky, Evening, Night",12,0
1431,https://cdn.pixabay.com/photo/2021/08/11/03/19/incense-sticks-6537296__340.jpg,"Incense Sticks, Drying, Hung Yen",42,9
1432,https://cdn.pixabay.com/photo/2021/09/02/13/36/pizza-6593504__340.jpg,"Pizza, Wood Fired Pizza",72,61
1433,https://cdn.pixabay.com/photo/2022/04/06/01/38/city-7114646__340.jpg,"City, Travel, Tourism, Buildings, Tower",2,0
1434,https://cdn.pixabay.com/photo/2021/12/16/05/59/trees-6873797__340.jpg,"Trees, Forest, Winter, Snow, Cold",84,78
1435,https://cdn.pixabay.com/photo/2022/02/09/17/53/salad-7003903__480.jpg,"Salad, Lamb'S Lettuce, Corn Salad",45,39
1436,https://cdn.pixabay.com/photo/2014/11/13/23/34/palace-530055__340.jpg,"Palace, London, Parliament, Big Ben",872,100
1437,https://cdn.pixabay.com/photo/2019/11/22/18/41/christmas-4645449__340.jpg,"Christmas, Gifts, Present, Surprise",266,71
1438,https://cdn.pixabay.com/photo/2020/10/04/16/07/typewriter-5626841__340.jpg,"Typewriter, Antique, Vintage, Old, Retro",249,91
1439,https://cdn.pixabay.com/photo/2022/01/31/09/08/nature-6983033__340.jpg,"Nature, Valley, Travel, Exploration",42,54
1440,https://cdn.pixabay.com/photo/2021/08/04/10/19/chess-6521465__340.jpg,"Chess, Crown, King, Pawn, Strategic",10,4
1441,https://cdn.pixabay.com/photo/2016/11/29/01/51/wood-1866654__340.jpg,"Wood, Floor, Backdrop, Background, Board",321,64
1442,https://cdn.pixabay.com/photo/2017/12/12/11/37/bastei-3014467__340.jpg,"Bastei, Bridge, Rock Formation",603,64
1443,https://cdn.pixabay.com/photo/2022/03/30/10/02/roses-7100907__340.jpg,"Roses, Flower, Petals, Pink Flowers",3,0
1444,https://cdn.pixabay.com/photo/2022/04/01/14/51/melon-flowers-7104988__340.jpg,"Melon Flowers, Flowers, Melon Blossoms",0,0
1445,https://cdn.pixabay.com/photo/2022/03/28/02/37/swan-7096428__340.jpg,"Swan, Lake, Black Swan, River, Bird",11,14
1446,https://cdn.pixabay.com/photo/2021/08/04/15/45/waterfall-6522033__340.jpg,"Waterfall, Nature, Exploration, Outdoors",109,21
1447,https://cdn.pixabay.com/photo/2022/03/29/16/28/animal-7099734__340.jpg,"Animal, Cat, Mammal, Feline, Pet, Stray",6,1
1448,https://cdn.pixabay.com/photo/2022/03/14/12/37/storks-nest-7068127__340.jpg,"Stork'S Nest, Stork, Bird, Nest, Build",18,15
1449,https://cdn.pixabay.com/photo/2022/04/08/15/18/homeless-7119684__480.jpg,"Homeless, Monochrome, Street, Beggar",0,0
1450,https://cdn.pixabay.com/photo/2015/03/11/12/31/buildings-668616__340.jpg,"Buildings, River, City, Cityscape",766,174
1451,https://cdn.pixabay.com/photo/2022/01/23/21/04/friendship-6961952__340.jpg,"Friendship, Dog, Man, Crow, Animal, Bird",25,14
1452,https://cdn.pixabay.com/photo/2021/08/30/21/48/ferris-wheel-6587185__340.jpg,"Ferris Wheel, Amusement Park, Ride",21,8
1453,https://cdn.pixabay.com/photo/2022/03/25/08/04/wallflower-7090453__340.jpg,"Wallflower, Buds, Flower",17,15
1454,https://cdn.pixabay.com/photo/2022/04/06/11/51/tulip-7115419__340.jpg,"Tulip, Flower, Red Flower, Petals",4,2
1455,https://cdn.pixabay.com/photo/2022/02/27/23/40/stealth-7038292__340.jpg,"Stealth, Bombers, Aircraft",33,50
1456,https://cdn.pixabay.com/photo/2022/04/04/13/18/winter-7111243__340.jpg,"Winter, Poland, Mountains, Nature",1,0
1457,https://cdn.pixabay.com/photo/2016/11/13/21/46/sheep-1822137__340.jpg,"Sheep, Curious, Look, Farm, Animal",724,116
1458,https://cdn.pixabay.com/photo/2022/02/24/13/28/flower-7032454__340.jpg,"Flower, Bee, Pollination, Insect",40,55
1459,https://cdn.pixabay.com/photo/2022/03/27/17/07/flowers-7095657__340.jpg,"Flowers, Tulips, Bloom, Blossom, Botany",9,4
1460,https://cdn.pixabay.com/photo/2016/11/22/20/02/abstract-1850417__340.jpg,"Abstract, Art, Backdrop, Background",620,90
1461,https://cdn.pixabay.com/photo/2021/06/26/08/49/lighthouse-6365680__340.jpg,"Lighthouse, Island, Sea, Tower, Ocean",58,15
1462,https://cdn.pixabay.com/photo/2022/01/09/13/52/nature-6926016__340.jpg,Ruht in sich…. Seit Jahrhunderten,49,34
