,img_link,tags,likes,comments
2514,https://cdn.pixabay.com/photo/2017/01/13/07/41/kyoto-1976538__340.jpg,"Kyoto, Japan, Statue, Jizo, Japanese",414,44
2515,https://cdn.pixabay.com/photo/2019/08/06/09/16/mountain-4387827__340.jpg,"Mountain, Flowers, Landscape, Grass",227,49
2516,https://cdn.pixabay.com/photo/2020/09/05/16/01/butterfly-5546907__340.jpg,"Butterfly, Butterfly Wings, Lepidoptera",166,70
2517,https://cdn.pixabay.com/photo/2022/03/26/06/59/sunset-7092333__340.jpg,"Sunset, Travel, Dusk, Burma, Myanmar",3,1
2518,https://cdn.pixabay.com/photo/2022/03/28/09/25/nature-7097038__340.jpg,"Nature, Outdoors, Wilderness, Siberia",0,0
2519,https://cdn.pixabay.com/photo/2019/12/24/08/21/girl-4716186__340.jpg,"Girl, Grapes, Beauty, Food, Fruit, Diet",291,46
2520,https://cdn.pixabay.com/photo/2022/04/06/20/38/flower-7116321__340.jpg,"Flower, Petals, Stamen, Flora, Botany",0,0
2521,https://cdn.pixabay.com/photo/2017/07/02/21/34/notebook-2465914__340.jpg,"Notebook, Note, Notes, Diary, Write",445,52
2522,https://cdn.pixabay.com/photo/2022/02/07/21/47/sunset-7000338__340.jpg,"Sunset, Boat, Shipwreck, Sea, Clouds",14,2
2523,https://cdn.pixabay.com/photo/2022/04/01/15/43/leaves-7105072__340.jpg,"Leaves, Plants, Red Leaves, Foliage",2,0
2524,https://cdn.pixabay.com/photo/2019/10/08/18/13/matterhorn-4535693__340.jpg,"Matterhorn, Switzerland, Valais, Zermatt",236,90
2525,https://cdn.pixabay.com/photo/2022/03/20/11/00/flower-7080581__480.jpg,"Flower, Crocus, Bloom, Botany, Blossom",1,0
2526,https://cdn.pixabay.com/photo/2021/07/03/23/24/chamomile-6385050__340.jpg,"Chamomile, Flowers, Daisies, Petals",38,11
2527,https://cdn.pixabay.com/photo/2022/03/18/21/35/mushroo-7077501__340.jpg,"Mushroo, Plant, Toadstool, Fungus",6,0
2528,https://cdn.pixabay.com/photo/2021/08/27/12/42/robin-6578589__340.jpg,"Robin, Songbird, Small Bird, Garden Bird",62,51
2529,https://cdn.pixabay.com/photo/2021/11/10/01/57/alien-6782767__340.jpg,"Alien, Art, Character, Design, Effect",8,3
2530,https://cdn.pixabay.com/photo/2022/01/07/08/43/thailand-6921418__340.jpg,"Thailand, Island, Sea, Nature, Ocean",10,2
2531,https://cdn.pixabay.com/photo/2022/03/18/11/07/ground-7076402__340.jpg,"Ground, Street, Town, Paving Stones",4,2
2532,https://cdn.pixabay.com/photo/2022/03/27/15/15/daffodils-7095386__340.jpg,"Daffodils, Chicken Decor, Handicraft",5,4
2533,https://cdn.pixabay.com/photo/2017/09/04/20/52/bald-eagle-2715461__340.jpg,"Bald Eagle, Head, Raptor, Close Up",572,50
2534,https://cdn.pixabay.com/photo/2018/08/13/15/37/wolf-3603190__340.jpg,"👉 If you find my content useful, you can send a donation via coffee button",219,23
2535,https://cdn.pixabay.com/photo/2021/11/07/11/57/body-painting-6775780__340.jpg,"Body Painting, Makeup, Cosplay, Portrait",25,11
2536,https://cdn.pixabay.com/photo/2017/04/08/10/42/burj-khalifa-2212978__340.jpg,"Burj Khalifa, Emirates, Dubai, Uae",308,48
2537,https://cdn.pixabay.com/photo/2017/12/01/08/52/bokeh-2990426__340.jpg,"Bokeh, Light, Background, Points",356,58
2538,https://cdn.pixabay.com/photo/2018/11/02/19/04/sunflowers-3790834__340.jpg,"Sunflowers, Flowers, Sunflower Field",225,49
2539,https://cdn.pixabay.com/photo/2019/10/08/14/38/landscape-4535199__340.jpg,"Landscape, Nature, Trees, The Water",257,61
2540,https://cdn.pixabay.com/photo/2021/10/30/04/12/river-6753492__480.jpg,"River, Forest, Fall, Autumn, Nature",45,41
2541,https://cdn.pixabay.com/photo/2022/02/27/15/34/magpie-7037512__340.jpg,"Magpie, Pica Pica, Bird, Feathers",20,21
2542,https://cdn.pixabay.com/photo/2021/12/05/02/33/parrot-6846356__340.jpg,"Parrot, King Parrot",67,82
2543,https://cdn.pixabay.com/photo/2020/12/24/08/09/monk-5856776__340.jpg,"Monk, Mountains, Child, Young, Buddhist",37,7
2544,https://cdn.pixabay.com/photo/2021/09/17/13/19/vineyard-6632661__340.jpg,"Vineyard, Winegrowing, Stellenbosch",18,2
2545,https://cdn.pixabay.com/photo/2020/10/27/07/40/cheetahs-5689873__340.jpg,"Cheetahs, Animals, Safari",93,13
2546,https://cdn.pixabay.com/photo/2022/01/26/00/40/flower-6967603__340.jpg,"Flower, Sunflower, Blossom, Bloom",50,48
2547,https://cdn.pixabay.com/photo/2021/08/28/18/30/horse-6581618__340.jpg,"Horse, Carriage, Coach, Vintage",19,11
2548,https://cdn.pixabay.com/photo/2020/06/01/12/58/fantasy-5246529__340.jpg,"Fantasy, Angel, Reflection, Water, Girl",244,95
2549,https://cdn.pixabay.com/photo/2018/02/21/10/16/train-station-3169964__340.jpg,"Train Station, Couple, Traveling",382,49
2550,https://cdn.pixabay.com/photo/2022/03/08/09/06/trees-7055391__340.jpg,"Trees, Nature, Forest, Landscape, Fog",8,0
2551,https://cdn.pixabay.com/photo/2020/04/18/16/21/online-5059828__340.jpg,"Online, Meeting, Virtual, Skype, Zoom",68,23
2552,https://cdn.pixabay.com/photo/2022/03/13/22/35/switzerland-7066946__480.jpg,"Switzerland, Hills, Weggis, Lake Lucerne",5,4
2553,https://cdn.pixabay.com/photo/2022/03/12/16/21/flower-7064494__340.jpg,"Flower, Crocus, Grasses, Petals",9,3
2554,https://cdn.pixabay.com/photo/2022/04/06/10/32/flowers-7115285__340.jpg,"Flowers, Siberian Quill, Bloom, Blossom",0,0
2555,https://cdn.pixabay.com/photo/2021/09/10/09/33/flowers-6612670__340.jpg,"Flowers, The Buds, Garden, Summer",20,7
2556,https://cdn.pixabay.com/photo/2021/11/07/11/24/background-6775557__340.jpg,"Background, Paint Splatters",3,0
2557,https://cdn.pixabay.com/photo/2020/06/05/22/21/beach-5264739__340.jpg,"Beach, Sunrise, Clouds, Ocean, Beach",183,21
2558,https://cdn.pixabay.com/photo/2021/11/09/15/53/castle-6781821__340.jpg,"Castle, Gruyères Castle, To Travel",59,49
2559,https://cdn.pixabay.com/photo/2022/02/17/20/37/dog-7019418__340.jpg,"Dog, Breed, Shiba, Domestic Animal",2,1
2560,https://cdn.pixabay.com/photo/2013/11/24/11/10/lab-217043__340.jpg,"Lab, Research, Chemistry, Test",340,95
2561,https://cdn.pixabay.com/photo/2022/03/04/02/01/swan-7046330__340.jpg,"Swan, Lake, Waterfowl, Bird, Animal",21,19
2562,https://cdn.pixabay.com/photo/2016/11/08/17/59/white-1809005__340.jpg,"White, Painted, Wood, Bright, Texture",297,53
2563,https://cdn.pixabay.com/photo/2022/03/12/04/34/moon-7063340__340.jpg,"Moon, Natural Satellite, Half Moon",8,12
2564,https://cdn.pixabay.com/photo/2021/10/15/09/42/farmers-6711562__340.jpg,"Farmers, Harvest, Vietnam, Farm, Field",15,3
2565,https://cdn.pixabay.com/photo/2022/01/25/23/44/nature-6967566__340.jpg,"Nature, Boats, Lake, Coast, Travel, Sail",34,30
2566,https://cdn.pixabay.com/photo/2022/03/25/05/24/zebra-7090307__340.jpg,"Zebra, Mountain Zebra, Africa, Namibia",4,2
2567,https://cdn.pixabay.com/photo/2022/02/18/01/08/goldcrest-7019715__340.jpg,"Goldcrest, Bird, Branch, Perched, Animal",11,7
2568,https://cdn.pixabay.com/photo/2020/02/13/19/17/cherry-blossoms-4846635__480.jpg,"Cherry Blossoms, Flowers, Tree, Bloom",194,71
2569,https://cdn.pixabay.com/photo/2021/10/30/11/47/polar-bear-6754130__340.jpg,"Polar Bear, Christmas, Christmas Card",15,2
2570,https://cdn.pixabay.com/photo/2021/07/16/02/07/palace-6469748__340.jpg,"Palace, Tibet, Mountains, Potala, Lhasa",13,6
2571,https://cdn.pixabay.com/photo/2022/03/04/18/57/nature-7047886__340.jpg,"Nature, Landscape, Mountains, Lake",5,3
2572,https://cdn.pixabay.com/photo/2020/06/09/15/16/brugge-5278796__340.jpg,"Brugge, Bruges, Belgium, Architecture",145,20
2573,https://cdn.pixabay.com/photo/2022/03/20/13/12/insect-7080802__340.jpg,"Insect, Flower, Bumblebee, Pollination",6,4
2574,https://cdn.pixabay.com/photo/2022/04/01/21/27/graveyard-7105687__340.jpg,"Graveyard, Tombstones, Washington Dc",0,0
2575,https://cdn.pixabay.com/photo/2016/12/15/23/22/lake-1910263__340.jpg,"Lake, Trees, Reflection, Sunset, Dusk",307,35
2576,https://cdn.pixabay.com/photo/2020/12/03/00/58/flower-of-christmas-5799112__340.jpg,"Flower Of Christmas, Flowers, Petals",94,12
2577,https://cdn.pixabay.com/photo/2021/01/22/13/02/birds-5940016__340.jpg,"Birds, Branch, Grass, Feathers, Plumage",189,127
2578,https://cdn.pixabay.com/photo/2018/04/11/08/59/rails-3309912__340.jpg,"Rails, Soft, Tracks, Railroad",338,73
2579,https://cdn.pixabay.com/photo/2017/02/10/15/10/love-2055372__340.jpg,"Love, Couple, Family, Sweethearts, Young",353,41
2580,https://cdn.pixabay.com/photo/2022/03/27/17/51/squirrel-7095726__340.jpg,"Squirrel, Mammal, Rodent, Nature",3,0
2581,https://cdn.pixabay.com/photo/2021/09/02/15/38/artichokes-6593764__340.jpg,"Artichokes, Plant, Flowering Vegetables",62,40
2582,https://cdn.pixabay.com/photo/2022/03/20/06/46/common-heron-7080088__340.jpg,"Common Heron, Birds, Wing, Animal",6,4
2583,https://cdn.pixabay.com/photo/2022/03/10/11/49/beach-7059725__340.jpg,"Beach, Sea, Coast, Horizon, Sand, Water",1,0
2584,https://cdn.pixabay.com/photo/2022/02/07/12/57/camellia-6999331__340.jpg,Aufgenommen am 28.1.2022,33,30
2585,https://cdn.pixabay.com/photo/2018/05/09/15/28/question-3385451__340.jpg,"Question, Doubt, Problem, Mark",172,47
2586,https://cdn.pixabay.com/photo/2022/02/18/11/46/rabbit-7020486__340.jpg,"Rabbit, Animal, Pet, Holland Lop, Bunny",10,6
2587,https://cdn.pixabay.com/photo/2020/01/14/02/09/vapor-4763904__340.jpg,"Vapor, Condensation, Glass, Window",99,17
2588,https://cdn.pixabay.com/photo/2015/05/30/01/18/vegetables-790022__340.jpg,"Vegetables, Garden, Harvest, Organic",591,130
2589,https://cdn.pixabay.com/photo/2012/11/28/08/54/milky-way-67504__340.jpg,"Milky Way, Space, Stars, Universe",484,61
2590,https://cdn.pixabay.com/photo/2022/02/11/13/50/lake-7007354__340.jpg,"Lake, Nature, Boat, House, Travel",11,8
2591,https://cdn.pixabay.com/photo/2019/07/07/06/33/man-4321831__340.jpg,"Man, Window, Clouds, Dreams, View, Dream",283,40
2592,https://cdn.pixabay.com/photo/2022/04/02/09/52/blossoms-7106611__340.jpg,"Blossoms, Flowers, White Flowers, Nature",1,1
2593,https://cdn.pixabay.com/photo/2021/02/02/16/41/flower-5974552__340.jpg,"Flower, Peach Blossom, Pink Flower",81,19
2594,https://cdn.pixabay.com/photo/2021/09/02/19/38/shotgun-6594315__340.jpg,"Shotgun, Hitman, Peaky Blinders",21,13
2595,https://cdn.pixabay.com/photo/2021/07/02/21/36/alpine-village-6382622__340.jpg,"Alpine Village, Mountain, Switzerland",75,68
2596,https://cdn.pixabay.com/photo/2021/02/10/10/11/church-6001550__340.jpg,"Church, Mountains, Winter, Steeple",99,43
2597,https://cdn.pixabay.com/photo/2022/03/07/15/21/white-flowers-7053942__480.jpg,"White Flowers, Flowers, Petals, Branch",14,14
2598,https://cdn.pixabay.com/photo/2017/12/04/16/20/background-2997277__340.jpg,"Background, Backdrop, Christmas",187,30
2599,https://cdn.pixabay.com/photo/2020/12/16/18/25/zebras-5837321__340.jpg,"Zebras, Animals, Safari, Mammals, Equine",61,13
2600,https://cdn.pixabay.com/photo/2018/09/09/18/04/judge-3665164__340.jpg,"Judge, Hammer, Auction Hammer, Auction",103,42
2601,https://cdn.pixabay.com/photo/2022/02/10/22/14/animal-7006240__340.jpg,Home Sweet Home,36,30
2602,https://cdn.pixabay.com/photo/2021/02/13/07/00/fish-6010472__340.jpg,"Fish, Sharks, Sea, Water, Ocean",28,5
2603,https://cdn.pixabay.com/photo/2021/09/20/12/48/stars-6640785__340.jpg,"Stars, Glitter, Golden, Sparkle, Festive",10,4
2604,https://cdn.pixabay.com/photo/2016/11/16/17/02/butterfly-1829404__340.jpg,"Butterfly, Nature, Flower, Insect",464,47
2605,https://cdn.pixabay.com/photo/2021/12/12/08/28/soup-6864550__340.jpg,"Soup, Plate, Spoon, Meal, Food",35,30
2606,https://cdn.pixabay.com/photo/2022/02/18/16/29/mountain-church-7021013__340.jpg,"Mountain Church, Mountain Panorama",22,26
2607,https://cdn.pixabay.com/photo/2022/03/31/18/42/organ-7103540__340.jpg,"Organ, Music, Church Organ",3,0
2608,https://cdn.pixabay.com/photo/2021/03/23/06/23/flamingos-6116445__340.jpg,"Flamingos, Birds, Long-Legged, Long Neck",79,16
2609,https://cdn.pixabay.com/photo/2017/12/10/00/15/ice-3009009__340.jpg,"Ice Cream, Stars, Winter, Snow",358,54
2610,https://cdn.pixabay.com/photo/2018/03/23/17/56/ruins-3254396__340.png,"Ruins, Gothic, Medieval, Architecture",251,40
2611,https://cdn.pixabay.com/photo/2021/12/18/17/54/nature-6879473__340.jpg,"Nature, Forest, Landscape, Pines, Trees",22,3
2612,https://cdn.pixabay.com/photo/2022/03/05/16/20/mountains-7049666__340.jpg,"Mountains, Geology, Rock Formations",14,18
2613,https://cdn.pixabay.com/photo/2022/01/25/06/39/horror-6965349__480.jpg,Software: Gimp 2.10.24,26,23
2614,https://cdn.pixabay.com/photo/2022/03/08/20/57/hummingbird-7056563__340.jpg,"Hummingbird, Bird, Perched, Animal",10,7
2615,https://cdn.pixabay.com/photo/2022/03/10/22/57/bee-7060888__340.jpg,"Bee, Insect, Pollinate, Pollination",12,9
2616,https://cdn.pixabay.com/photo/2021/09/25/15/46/sky-6655275__340.jpg,"Sky, Clouds, Sea, Reflection, Water",31,58
2617,https://cdn.pixabay.com/photo/2022/03/09/15/07/antennas-7058047__340.jpg,"Antennas, Crows, Ravens, Tv Antenna",14,12
2618,https://cdn.pixabay.com/photo/2022/03/13/07/04/highland-cattle-7065441__340.jpg,"Highland Cattle, Cow, Cattle, Animal",10,7
2619,https://cdn.pixabay.com/photo/2022/03/07/14/53/owl-7053838__340.jpg,"Owl, Bird, Perched, Birds Of Prey",22,18
2620,https://cdn.pixabay.com/photo/2021/07/31/00/02/combine-6510920__340.jpg,"Combine, Harvester, Blades, Harvest",61,71
2621,https://cdn.pixabay.com/photo/2018/02/02/17/14/triangle-3125882__340.jpg,"Triangle, Quality, Time, Cost",177,34
2622,https://cdn.pixabay.com/photo/2022/02/06/17/27/chamomile-6997706__340.jpg,"Chamomile, Flowers, Plants, Herb, Petals",37,42
2623,https://cdn.pixabay.com/photo/2021/05/29/20/20/hot-air-balloon-6294208__340.jpg,"Hot Air Balloon, Thunderstorm, Fantasy",56,25
2624,https://cdn.pixabay.com/photo/2016/12/17/13/42/autumn-1913485__340.jpg,"Autumn, Leaves, Tree, Foliage",623,79
2625,https://cdn.pixabay.com/photo/2018/03/11/13/38/munich-3216809__340.jpg,"Munich, Alley, Buildings, Cobblestone",298,31
2626,https://cdn.pixabay.com/photo/2022/01/23/12/56/bird-6960750__480.jpg,"Bird, Sparrow, Ornithology, Species",36,7
2627,https://cdn.pixabay.com/photo/2021/04/24/13/28/garden-plants-6204106__340.jpg,"Garden Plants, Garden, Herb Garden",42,19
2628,https://cdn.pixabay.com/photo/2018/04/29/20/28/waves-3361029__340.jpg,"Waves, Sea, Turquoise, Ocean, Waves",376,49
2629,https://cdn.pixabay.com/photo/2022/03/31/03/12/sea-7102124__340.jpg,"Sea, People, Beach, Nature, Water, Pier",2,1
2630,https://cdn.pixabay.com/photo/2017/08/14/17/12/cows-2641195__340.jpg,"Cows, Cattle, Farm, Sky, Clouds, Pasture",336,65
2631,https://cdn.pixabay.com/photo/2022/03/29/21/44/gems-7100235__340.jpg,"Gems, Sprouts, Pendants, Seeds, Pollen",3,3
2632,https://cdn.pixabay.com/photo/2022/04/03/12/25/harrisia-7108823__340.jpg,"Harrisia, Growth, Plant, Nature, Botany",1,0
2633,https://cdn.pixabay.com/photo/2022/03/20/11/50/bird-7080659__340.jpg,"Bird, Common Blackbird, Ornithology",4,4
2634,https://cdn.pixabay.com/photo/2021/11/12/00/33/farmland-6787615__340.jpg,"Farmland, Rice Fields, Agriculture",10,2
2635,https://cdn.pixabay.com/photo/2022/01/22/23/13/house-6959399__340.jpg,"House, Cottage, Village, Home, Building",7,0
2636,https://cdn.pixabay.com/photo/2022/03/05/20/02/animal-7050199__340.jpg,"Animal, Dog, Mammal, Pet, Canine, Fur",20,16
2637,https://cdn.pixabay.com/photo/2018/11/12/18/44/thanksgiving-3811492__480.jpg,"Thanksgiving, Pumpkin, Fall, Autumn",163,19
2638,https://cdn.pixabay.com/photo/2019/06/27/03/42/beach-4301479__340.jpg,"Beach, Shell, Sea, Vacations, Sand",237,36
2639,https://cdn.pixabay.com/photo/2018/09/21/16/14/succulents-3693409__340.jpg,green plants,334,98
2640,https://cdn.pixabay.com/photo/2019/07/13/10/25/payment-4334491__340.jpg,"Payment, Online Payment, Card Payment",65,14
2641,https://cdn.pixabay.com/photo/2022/02/26/00/10/animal-7035052__340.jpg,"Animal, Mammal, Baboon, Ape, Primate",21,1
2642,https://cdn.pixabay.com/photo/2022/03/24/15/56/animal-7089320__340.jpg,"Animal, Cat, Feline, Pet, Mammal, Fur",5,2
2643,https://cdn.pixabay.com/photo/2018/10/29/15/28/laptop-3781381__340.jpg,"Laptop, Computer, Green Screen, Notebook",78,21
2644,https://cdn.pixabay.com/photo/2022/03/06/10/16/birds-7051288__340.jpg,"Birds, Mallard, Ornithology, Drake",23,20
2645,https://cdn.pixabay.com/photo/2020/10/03/17/44/mountain-5624148__340.jpg,"Mountain, Chamois, Alps, Italy",159,82
2646,https://cdn.pixabay.com/photo/2021/07/13/19/55/cliff-6464415__340.jpg,"Cliff, Coast, Sea, Cape Greco, Ocean",42,18
2647,https://cdn.pixabay.com/photo/2022/03/25/15/55/flowers-7091321__340.jpg,"Flowers, Petals, Plant, Blossom, Bloom",3,0
2648,https://cdn.pixabay.com/photo/2022/03/23/16/20/blackthorn-7087491__340.jpg,"Blackthorn, Flowers, Spring",7,4
2649,https://cdn.pixabay.com/photo/2021/06/03/01/54/spices-6305703__340.jpg,"Spices, Border, Background, Copy Space",13,1
2650,https://cdn.pixabay.com/photo/2021/11/01/15/53/smoothie-6760874__340.jpg,"Smoothie, Fruit, Tropical, Drink",7,0
2651,https://cdn.pixabay.com/photo/2021/12/10/20/56/mushrooms-6861432__340.jpg,"Mushrooms, Forest, Moss, Fungus",37,28
2652,https://cdn.pixabay.com/photo/2021/12/18/19/08/wheat-6879571__340.jpg,Junge getreideähren mit zarten wassertropfen,18,11
2653,https://cdn.pixabay.com/photo/2021/11/25/20/49/blueberries-6824569__340.jpg,"Blueberries, Berries, Blue, Fresh",19,4
2654,https://cdn.pixabay.com/photo/2022/03/11/14/21/flower-buds-7062355__340.jpg,"Flower Buds, Blooming Flowers, Flowers",12,12
2655,https://cdn.pixabay.com/photo/2021/08/10/18/12/tree-6536637__340.jpg,"Tree, Field, Grass, Bench, Nature, Sun",38,3
2656,https://cdn.pixabay.com/photo/2020/05/16/02/20/moon-5175691__340.jpg,"Moon, Night, Reflection, Dark, Full Moon",175,99
2657,https://cdn.pixabay.com/photo/2021/01/22/20/16/heron-5941013__340.jpg,"Heron, Hern, Fish, Bird, Lake, Avian",102,19
2658,https://cdn.pixabay.com/photo/2022/03/16/08/04/stone-house-7071847__340.jpg,"Stone House, Cottage, Countryside",10,10
2659,https://cdn.pixabay.com/photo/2016/03/16/23/55/flea-market-1262036__340.jpg,"Flea Market, Gramophone, Music, Speakers",577,77
2660,https://cdn.pixabay.com/photo/2018/11/29/23/32/sky-3846778__340.jpg,"Sky, Birds, Scenic, Dusk, Dawn, Sunrise",360,92
2661,https://cdn.pixabay.com/photo/2022/02/14/10/50/bird-7012894__340.jpg,"Bird, Feeding, Ornithology, Species",25,24
2662,https://cdn.pixabay.com/photo/2020/04/20/10/12/passover-5067642__340.jpg,"Passover, Maundy Thursday, Last Supper",42,14
2663,https://cdn.pixabay.com/photo/2022/02/22/18/38/dog-7029390__340.jpg,"Dog, Pet, Canine, Animal, Fur, Snout",25,4
2664,https://cdn.pixabay.com/photo/2021/09/16/15/01/animal-6630305__340.jpg,"Animal, Bat, Wildlife, Creature, Wings",12,2
2665,https://cdn.pixabay.com/photo/2022/03/01/09/14/drake-7040870__480.jpg,Add a description (optional),26,21
2666,https://cdn.pixabay.com/photo/2022/03/26/13/08/river-7092902__340.jpg,"River, Wilderness, Dusk, Woods, Outdoors",4,1
2667,https://cdn.pixabay.com/photo/2021/10/24/08/45/castle-6737424__340.jpg,Deep in the heart of France…,58,34
2668,https://cdn.pixabay.com/photo/2020/08/14/16/09/feather-5488401__340.jpg,"Feather, Bird Feather, Filigree",160,24
2669,https://cdn.pixabay.com/photo/2021/11/17/15/12/our-lady-6803827__340.jpg,"Our Lady, Cathedral, Historical, Tourism",11,10
2670,https://cdn.pixabay.com/photo/2022/03/18/04/25/railroad-tracks-7075873__340.jpg,"Railroad Tracks, Nature, Spring",0,0
2671,https://cdn.pixabay.com/photo/2022/02/14/16/29/mushroom-7013443__340.jpg,Aufgenommen am 14.02.22,27,25
2672,https://cdn.pixabay.com/photo/2021/04/20/08/14/town-6193205__340.jpg,"Town, Bridge, River, Arch Bridge, Houses",21,3
2673,https://cdn.pixabay.com/photo/2022/02/06/16/03/angel-6997529__340.jpg,"Angel, Statues, Wing, Sculptures, Old",35,33
2674,https://cdn.pixabay.com/photo/2022/02/28/21/32/forests-7040173__340.jpg,"Forests, Trees, Sunlight, Woods, Foliage",9,7
2675,https://cdn.pixabay.com/photo/2017/06/11/02/04/panorama-2391345__340.jpg,"Panorama, Sunset, Heaven",358,66
2676,https://cdn.pixabay.com/photo/2021/08/20/22/04/flowers-6561370__340.jpg,"Flowers, Music Sheet, Vintage",22,10
2677,https://cdn.pixabay.com/photo/2019/12/15/08/17/bedroom-4696556__340.jpg,"Bedroom, Visualization, Interior Design",81,17
2678,https://cdn.pixabay.com/photo/2022/03/16/06/21/rufous-collared-7071665__340.jpg,"Nombre común en Argentina: Chingolo, Nombre Científico: Zonotrichia capensis. Es un ave paseriforme, de amplia distribución en gran parte de América del Sur.",7,9
2679,https://cdn.pixabay.com/photo/2020/04/06/12/38/daisy-5009533__340.jpg,"Daisy, Shell, Nature, Moss, Close Up",299,40
2680,https://cdn.pixabay.com/photo/2016/02/19/11/33/drawing-pad-1209781__340.jpg,"Drawing Pad, Note Pad, White Background",469,71
2681,https://cdn.pixabay.com/photo/2022/03/31/20/30/nature-7103642__480.jpg,"Nature, Flowers, Flora, Bloom, Blossom",2,1
2682,https://cdn.pixabay.com/photo/2018/01/23/03/39/handshake-3100563__340.jpg,"Handshake, Agreement, Trade, Business",312,93
2683,https://cdn.pixabay.com/photo/2021/12/15/18/22/nature-6873186__340.jpg,"Nature, Alps, Travel, Exploration",51,69
2684,https://cdn.pixabay.com/photo/2022/02/07/15/54/mountains-6999728__340.jpg,"Mountains, Fog, Sunset, Cliffs, Forest",5,1
2685,https://cdn.pixabay.com/photo/2022/03/06/04/32/rose-7050812__340.jpg,"Rose, Flower, Petals, White Rose, Bloom",4,1
2686,https://cdn.pixabay.com/photo/2022/02/08/23/47/art-7002379__340.jpg,"Art, Pattern, Design, Wallpaper",16,25
2687,https://cdn.pixabay.com/photo/2015/08/18/22/01/lavenders-894919__340.jpg,"Lavenders, Flowers, Field, Farm",783,61
2688,https://cdn.pixabay.com/photo/2020/10/21/14/48/milky-way-5673357__340.jpg,"Milky Way, Galaxy, Fields, Estuary",131,17
2689,https://cdn.pixabay.com/photo/2022/03/27/10/45/cherry-blossom-7094718__340.jpg,"Cherry Blossom, Flowers, Spring, Branch",6,0
2690,https://cdn.pixabay.com/photo/2022/03/20/13/31/sea-7080834__340.jpg,"Sea, Coast, Sandstorm, Sahara, Dust",2,2
2691,https://cdn.pixabay.com/photo/2020/06/21/12/37/deer-5324645__340.jpg,奈良公園の鹿です、人間と共存しています。,190,0
2692,https://cdn.pixabay.com/photo/2021/08/05/22/46/wildfire-6525008__340.jpg,"Wildfire, Forest Fire, Bushfire, Fire",18,11
2693,https://cdn.pixabay.com/photo/2016/04/12/11/19/coffee-1324126__340.jpg,"Coffee, Coffee Beans, Cup, Mug, Beans",423,69
2694,https://cdn.pixabay.com/photo/2022/02/13/01/12/cosmos-7010140__340.jpg,"Cosmos, Flower, Flora, Nature",12,16
2695,https://cdn.pixabay.com/photo/2021/12/29/23/59/feather-6902994__340.jpg,"Feather, Beach, Shore, Coast, Sand, Sea",58,42
2696,https://cdn.pixabay.com/photo/2022/03/23/20/38/bee-7087877__340.jpg,"Bee, Insect, Flower, Honey Bee",2,0
2697,https://cdn.pixabay.com/photo/2022/03/26/17/46/flowers-7093276__480.jpg,"Flowers, Daffodil, Spring, Bloom",1,1
2698,https://cdn.pixabay.com/photo/2020/12/14/06/29/hanok-5830098__340.jpg,"Hanok, Village, Sunrise, Dawn, Morning",39,0
2699,https://cdn.pixabay.com/photo/2022/03/13/06/31/farmer-7065393__340.jpg,"Farmer, Agriculture, Punjab, Feed, Food",2,1
2700,https://cdn.pixabay.com/photo/2021/09/15/01/52/farm-6625453__340.jpg,"Farm, Tractor, Plow, Tillage",5,3
2701,https://cdn.pixabay.com/photo/2021/09/27/16/46/chrysanthemums-6661564__340.jpg,"Chrysanthemums, Flowers, Plants, Petals",36,21
2702,https://cdn.pixabay.com/photo/2022/03/29/16/45/flowers-7099769__340.jpg,"Flowers, Daffodil, Bloom, Blossom",2,0
2703,https://cdn.pixabay.com/photo/2021/10/25/12/25/white-silk-6740729__340.jpg,"White Silk, Flowers, Background",6,4
2704,https://cdn.pixabay.com/photo/2021/12/17/09/34/christmas-drink-6876097__340.jpg,"Christmas Drink, Mulled Wine, Christmas",14,3
2705,https://cdn.pixabay.com/photo/2017/04/26/15/04/religious-2262785__340.jpg,"Religious, Muhammad, Religion, Islam",206,61
2706,https://cdn.pixabay.com/photo/2021/12/19/18/45/combing-6881725__340.jpg,"Combing, Drying The Hair, Hair, Dryer",3,2
2707,https://cdn.pixabay.com/photo/2021/09/11/16/08/middle-eastern-food-6615971__340.jpg,"Middle Eastern Food, Kebab",11,3
2708,https://cdn.pixabay.com/photo/2022/03/12/19/59/beetle-7064779__340.jpg,"Beetle, Weevil, Bug, Insect, Nature",4,1
2709,https://cdn.pixabay.com/photo/2022/02/19/01/18/mountain-7021776__340.jpg,"Mountain, Church, Snowfall, Cold",15,9
2710,https://cdn.pixabay.com/photo/2022/02/13/23/19/horse-7012161__340.jpg,"Horse, Horse'S Eye, Close-Up, Equidae",33,53
2711,https://cdn.pixabay.com/photo/2021/10/31/14/08/walnut-6757529__480.jpg,"Walnut, Nuts, Healthy, Market, Diet",14,3
2712,https://cdn.pixabay.com/photo/2015/11/05/23/02/chichen-itza-1025099__340.jpg,"Chichen Itza, Mexico, Pyramid, Milky Way",391,39
2713,https://cdn.pixabay.com/photo/2022/03/11/17/09/plant-7062662__340.jpg,"Plant, Stinking Hellebore, Wildflower",18,17
2714,https://cdn.pixabay.com/photo/2022/03/05/18/39/animal-7050023__340.jpg,"Animal, Cat, Feline, Fur, Whiskers, Pet",9,3
2715,https://cdn.pixabay.com/photo/2022/02/27/09/04/mountains-7036893__340.jpg,Panoramablick auf Altaussee im Winter. Steiermark in Österreich,18,13
2716,https://cdn.pixabay.com/photo/2021/11/01/18/27/billboard-6761326__340.jpg,"Billboard, Advertising, Advert, Business",3,1
2717,https://cdn.pixabay.com/photo/2016/11/18/18/32/wedding-1836315__340.jpg,"Wedding, Couple, Marriage",307,35
2718,https://cdn.pixabay.com/photo/2022/03/14/22/25/country-house-7069130__340.jpg,"Country House, Flowers, Meadow, Trees",4,1
2719,https://cdn.pixabay.com/photo/2017/03/20/14/33/pyramids-2159286__340.jpg,"Pyramids, Egypt, Giza, Archeology",336,71
2720,https://cdn.pixabay.com/photo/2022/03/07/12/27/egyptian-goose-7053539__340.jpg,"Egyptian Goose, Goose, Bird, Waterfowl",10,11
2721,https://cdn.pixabay.com/photo/2017/09/11/11/22/essential-oils-2738555__340.jpg,"Essential Oils, Cosmetology",356,67
2722,https://cdn.pixabay.com/photo/2022/02/13/16/47/horses-7011572__340.jpg,"Horses, Pond, Animal, Ride, Camargue",10,4
2723,https://cdn.pixabay.com/photo/2022/03/07/17/16/sakura-7054128__340.jpg,"Sakura, Flowers, Cherry Blossoms",4,0
2724,https://cdn.pixabay.com/photo/2022/03/22/14/48/catkins-7085230__340.jpg,"Catkins, Willow, Bush, Nature, Spring",8,7
